product_id,product_name,price
21749,LARGE RED SPOT WINDMILL,2.1
84692,BOX OF 24 COCKTAIL PARASOLS,0.32
84012,MAGIC SHEEP WOOL GROWING FROM PAPER,2.1
22203,MILK PAN RED RETROSPOT,3.39
17038,PORCELAIN BUDAH INCENSE HOLDER,0.1
POST,POSTAGE,5.0
D,Discount,0.59
84509B,FAIRY CAKE PLACEMATS,2.95
71053,WHITE METAL LANTERN,3.39
21728,METAL MEDINA LANTERN ,10.95
84880,WHITE WIRE EGG HOLDER,4.95
21702,SET 5 MINI GATEAUX  FRIDGE MAGNETS,1.69
21699,SET 5 MINI CHOCOLATE FRIDGE MAGNETS,1.69
20969,RED FLORAL FELTCRAFT SHOULDER BAG,3.39
20970,PINK FLORAL FELTCRAFT SHOULDER BAG,3.39
21649,ASSORTED TUTTI FRUTTI PHOTO FRAME,2.55
21832,CHOCOLATE CALCULATOR,1.45
20996,JAZZ HEARTS ADDRESS BOOK,0.36
90190C,SILVER/AMETHYST DROP EARRINGS LEAF,2.95
90186A,AMETHYST HOOP EARRING FLORAL LEAF,2.95
35838A,S/6 MULTICOLOUR ORNAMENETAL CANDLE,6.95
20718,RED SPOTTY SHOPPER BAG,1.06
20717,STRAWBERRY SHOPPER BAG,1.06
48138,DOOR MAT UNION FLAG,6.75
84570B,WHITE SATIN DRESS JEWEL STAND,4.95
84782B,BLACK 3 TIER GLASS PLATE STAND,12.75
21641,ASSORTED TUTTI FRUTTI KEYRING BALL,0.85
21850,BLUE  DIAMANTE PEN IN GIFT BOX,4.95
21174,POTTERING IN THE SHED METAL SIGN,1.65
21674,RIDGED GLASS PENDANT LAMPSHADE,14.95
84997A,GREEN 3 PIECE MINI DOTS CUTLERY SET,3.39
21561,DINOSAUR LUNCHBOX WITH CUTLERY,2.1
84932C,SMALL ORIENTAL BLUE FOLDING STOOL,1.95
84932D,SMALL ORIENTAL RED FOLDING STOOL,1.95
21311,SET/4 BIRD MIRROR MAGNETS ,0.38
90059C,DIAMANTE HAIR GRIP PACK/2 MONTANA,1.65
90082B,DIAMANTE BOW BROOCH RED COLOUR,6.35
90004A,JADE GREEN PAIR ENAMEL HAIR SLIDES,3.75
90059E,DIAMANTE HAIR GRIP PACK/2 RUBY,1.65
90059D,DIAMANTE HAIR GRIP PACK/2 PERIDOT,1.65
20664,TROPICAL HOLIDAY PURSE ,2.95
85129B,BEADED CRYSTAL HEART GREEN SMALL,1.25
85030,FRENCH CHATEAU OVAL PLATTER,7.95
85042,ANTIQUE LILY FAIRY LIGHTS,0.0
85141,JARDIN ETCHED GLASS FRUITBOWL,10.75
20846,ZINC HEART LATTICE T-LIGHT HOLDER,1.25
21248,DOOR HANGER  MUM + DADS ROOM,0.38
84595B,LARGE TRIFLE DESIGN L BLUE BOWL,3.75
84313A,PINK TV TRAY TABLE ,4.25
84313B,BLUE TV TRAY TABLE ,4.25
21307,SET/4 BUTTERFLY MIRROR MAGNETS,2.1
85199S,SMALL HANGING IVORY/RED WOOD BIRD,0.36
85132C,CHARLIE AND LOLA FIGURES TINS,8.49
47594A,CAROUSEL DESIGN WASHBAG,1.95
85119,WATERING CAN SINGLE HOOK PISTACHIO,1.69
35937,CERISE+GOLD CHRISTMAS STOCKING DEC,0.38
35966,FOLKART CHRISTMAS TREE T-LIGHT HOLD,0.38
35967,FOLK ART METAL STAR T-LIGHT HOLDER,0.38
37399,"ASS RETROSPOOF MUGS,SPORTS",0.42
72772,SET/4 SCENTED CANDLES IN RAMEKINS,1.25
84625D,WHITE NEWBAROQUE CANDLESTICK CANDLE,0.85
84869,CANDY BUTTON PHOTO ALBUM,1.95
85167B,BLACK GRAND BAROQUE PHOTO FRAME,4.25
90048,GREEN WITH METAL BAG CHARM,4.95
84670,JAPANESE CROCHETED ANIMAL,0.36
21111,"SWISS ROLL TOWEL, CHOCOLATE  SPOTS",2.55
21790,VINTAGE SNAP CARDS,0.72
48175,DOOR MAT CAMOUFLAGE,4.0
48111,DOOR MAT 3 SMILEY CATS,4.0
48179,DOOR MAT SWEET HOME,4.0
48194,DOORMAT HEARTS,4.0
21524,SPOTTY  HOME SWEET HOME DOORMAT,4.0
20685,RED SPOTTY COIR DOORMAT,4.0
48195,DOOR MAT GREEN PAISLEY ,4.0
48197,DOOR MAT BIRD ON THE WIRE,4.0
48129,DOOR MAT TOPIARY,4.0
48187,DOOR MAT NEW ENGLAND,4.0
48116,DOOR MAT MULTICOLOUR STRIPE,4.0
48185,DOOR MAT FAIRY CAKE,4.0
84519B,CARROT CHARLIE+LOLA COASTER SET,2.15
47591D,PINK FAIRY CAKE CHILD'S APRON,1.19
47590A,BLUE HAPPY BIRTHDAY BUNTING,3.2
21411,GINGHAM HEART  DOORSTOP RED,2.6
21329,DINOSAURS  WRITING SET ,1.0
21252,SET OF MEADOW  FLOWER STICKERS,1.7
21250,SET OF SKULL WALL STICKERS,1.69
20781,GOLD EAR MUFF HEADPHONES,1.95
72800C,S/4 PINK DINNER CANDLE SILVER FLOCK,0.79
81952V,ROUND PURPLE CLOCK W/SUCKER,0.85
22054,MINI CAKE STAND HANGING HEARTS,1.45
22055,MINI CAKE STAND  HANGING STRAWBERY,1.45
22059,CERAMIC STRWBERRY DESIGN MUG,1.25
22063,CERAMIC BOWL WITH STRAWBERRY DESIGN,2.55
21429,RED GINGHAM ROSE JEWELLERY BOX,1.45
85232D,SET/3 DECOUPAGE STACKING TINS,4.25
84529A,PINK KNITTED KIDS RUCKSACK,6.75
84529C,YELLOW KNITTED KIDS RUCKSACK,6.75
47583B,SET OF 3 WICKER BASKET TEA AND CAKE,24.95
85160A,WHITE BIRD GARDEN DESIGN MUG,1.25
85160B,BLACK BIRD GARDEN DESIGN MUG,1.25
21718,RED METAL BEACH SPADE ,1.25
84086C,PINK/PURPLE RETRO RADIO,2.95
75049L,LARGE CIRCULAR MIRROR MOBILE,0.85
21190,PINK HEARTS PAPER GARLAND,1.45
85114B,IVORY ENCHANTED FOREST PLACEMAT,1.45
84976,RECTANGULAR SHAPED MIRROR,1.69
85018B,S/6 PAPER BOXES BLOSSOM IMAGES ,4.25
85018C,S/6 PAPER BOXES CURIOUS IMAGES ,4.25
85018A,S/6 PAPER BOXES ROMANTIC IMAGES,4.25
35963,FOLKART ZINC CLIP ON ANGEL WINGS,0.38
21090,SET/6 COLLAGE PAPER PLATES,0.85
84631,FRUIT TREE AND BIRDS WALL PLAQUE,7.95
85127,SMALL SQUARE CUT GLASS CANDLESTICK,4.95
22320,BIRDS MOBILE VINTAGE DESIGN,5.45
90129F,RED GLASS TASSLE BAG CHARM,2.95
90129D,AMBER GLASS TASSLE BAG CHARM,2.95
90129E,PURPLE GLASS TASSLE BAG CHARM,2.95
20849,ZINC HEART LATTICE DOUBLE PLANTER,3.75
21001,ROSE DU SUD WASHBAG ,5.95
22137,BATHROOM SET LOVE HEART DESIGN,2.95
35652,VINTAGE BEAD CHAISE LONG JEWEL BOX,6.75
21257,VICTORIAN SEWING BOX MEDIUM,6.95
17011C,ORIGAMI LAVENDER INCENSE+FLOWER,0.65
17011E,ORIGAMI OPIUM SCENT INCENSE+FLOWER,0.65
17011D,ORIGAMI ROSE INCENSE+FLOWER,0.65
17011F,ORIGAMI SANDLEWOOD INCENSE+FLOWER,0.65
17013B,ORIGAMI JASMINE INCENSE IN TUBE,0.42
17012E,ORIGAMI OPIUM INCENSE/CANDLE SET ,0.85
17013C,ORIGAMI LAVENDER INCENSE IN TUBE,0.42
17013D,ORIGAMI ROSE INCENSE IN TUBE,0.42
37343,SPOTS DESIGN MUG W PINK INSIDE,1.27
21040,MODERN VINTAGE COTTON SHOPPING BAG,2.55
84616,SILVER ROCCOCO CHANDELIER,29.95
16043,POP ART PUSH DOWN RUBBER ,0.42
85071C,"CHARLIE+LOLA""EXTREMELY BUSY"" SIGN",0.38
85190,PINK FLOWER HANGING HEART ,0.85
84450A,PINK RABBIT SITTING EASTER,0.42
85189,HANGING BUTTERFLY  EGG,0.85
84847,FLORAL BATHROOM SET,3.75
21209,MULTICOLOUR HONEYCOMB FAN,1.65
47013A,WINE BOTTLE DRESSING LT.BLUE,0.29
84927F,PSYCHEDELIC TILE HOOK,2.1
84926F,PSYCHEDELIC TILE COASTER,1.25
90016B,GOLD/M.O.P PENDANT ORBIT NECKLACE,8.5
90018B,GOLD M.O.P ORBIT DROP EARRINGS,4.25
21556,CERAMIC STRAWBERRY MONEY BOX,2.25
22067,CHOC TRUFFLE GOLD TRINKET POT ,1.45
21805,WHITE CHRISTMAS TREE DECORATION ,0.36
21770,OPEN CLOSED METAL SIGN,4.25
22051,BLUE SCANDINAVIAN PAISLEY WRAP,0.34
79329,PINK FLOCK GLASS CANDLEHOLDER,0.38
21208,PASTEL COLOUR HONEYCOMB FAN,1.65
84905,PINK BUTTERFLY C/COVER ,4.95
84907,PINK/YELLOW PATCH CUSHION COVER,7.65
21407,BROWN CHECK CAT DOORSTOP ,3.75
72800F,4 IVORY DINNER CANDLES GOLD FLOCK,2.1
21030,SPACE CADET RED,1.25
82069,BEECH WOOD P/FRAME,7.25
79302M,"ART LIGHTS,FUNK MONKEY",2.55
21743,STAR PORTABLE TABLE LIGHT ,2.55
21503,TOYBOX  WRAP ,0.42
84970L,SINGLE HEART ZINC T-LIGHT HOLDER,0.79
51020A,SUMMER FUN DESIGN SHOWER CAP,1.25
84942,KASHMIR FOLKART HEART DISHES,1.69
21475,SWEETHEART CREAM STEEL FOLDIN CHAIR,14.95
35974,S/6 CHRISTMAS TREE PLACE SETTING,3.75
35930,PINK HEART CHRISTMAS DECORATION,0.38
35964,FOLKART CLIP ON STARS,2.1
22266,EASTER DECORATION HANGING BUNNY,0.65
20889,JARDIN DE FEMME SCENTED CANDLE,0.85
72740A,LARGE STRAWBERRY CHOCOLATE CANDLE,1.25
84680,CLASSICAL ROSE URN,2.95
84706C,PINK FLOCK TABLE CLOCK ,1.95
84706A,ENGLISH ROSE TABLE CLOCK,1.95
85167A,WHITE GRAND BAROQUE PHOTO FRAME,1.25
84732D,CUTE RABBIT CEATURE SCREEN ,1.65
84732B,CUTE BIRD CEATURE SCREEN,1.65
21128,GOLD FISHING GNOME,6.95
17091B,JASMINE TEA INCENSE IN TIN,0.85
84997C,BLUE 3 PIECE MINI DOTS CUTLERY SET,3.39
21496,WOODLAND CREATURES  WRAP,0.42
47581B,FAIRY CAKE WICKER PICNIC BASKET ,12.75
20820,SILVER LOOKING MIRROR,4.95
M,Manual,0.35
37352,BIRD IN TREE MUG ,1.25
20759,CHRYSANTHEMUM POCKET BOOK ,0.85
20845,ZINC HEART LATTICE 2 WALL PLANTER,6.35
21781,MA CAMPAGNE CUTLERY BOX,12.75
16202A,PASTEL PINK PHOTO ALBUM ,1.95
21945,STRAWBERRIES  DESIGN FLANNEL ,0.38
47585A,PINK FAIRY CAKE CUSHION COVER,3.75
90206A,GOLD DIAMANTE STAR BROOCH,4.95
22221,CAKE STAND LOVEBIRD 2 TIER PINK,9.95
37379A,PINK CHERRY BLOSSOM CUP & SAUCER,1.25
35001B,HAND OPEN SHAPE BLACK,3.49
85034C,3 ROSE MORRIS BOXED CANDLES,4.25
22188,BLACK HEART CARD HOLDER,3.95
21095,SET/6 POSIES PAPER PLATES,0.85
84625A,PINK NEW BAROQUECANDLESTICK CANDLE,0.85
21844,RETRO SPOT MUG,2.55
21319,GLASS CHALICE GREEN  SMALL ,1.45
72598,SET/12 TAPER CANDLES,0.64
20990,SPRING FLOWER CHOPSTICKS SET/5,1.65
20989,URBAN CHIC CHOPSTICKS SET/5,1.65
20726,LUNCH BAG WOODLAND,1.45
79029,GLASS HONEYPOT WASP CATCHER,1.65
85121C,RETRO LAUNDRY TUB PISTACHIO,8.5
72781,BLACK SILOUETTE CANDLE PLATE ,2.1
90186B,CRYSTAL HOOP EARRING FLORAL LEAF,2.95
90020,FILIGREE DIAMANTE CHAIN,12.75
90043,COPPER AND BRASS BAG CHARM,4.95
85145,JARDIN ETCHED GLASS LARGE BELL JAR,10.95
22183,CAKE STAND VICTORIAN FILIGREE MED,5.95
84675,FROG KING WATERING CAN,2.95
20667,CHERRY BLOSSOM PURSE,2.95
84870C,GREEN GEISHA GIRL ,3.75
85131D,BEADED CRYSTAL HEART PINK\ON STICK,1.25
47343A,FUSCHIA FLOWER PURSE WITH BEADS,1.49
47344B,BLUE FLOWER DES PURSE,1.25
84051,ASS COLOUR GLOWING TIARAS,0.85
22269,EGG CUP NATURAL CHICKEN,1.25
21419,CONCH SHELL,3.75
20888,SET 3 JARDIN DE FEMME SCENT CANDLES,3.75
21213,PACK OF 72 SKULL CAKE CASES,0.42
84989B,75 BLACK FAIRY CAKE CASES,0.42
71510,SQUARE METAL CANDLEHOLDER BASE,0.85
85130A,BEADED PEARL HEART WHITE LARGE,1.65
90199D,5 STRAND GLASS NECKLACE AMBER,6.35
84830,LARGE ENGLISH ARBORETUM,16.95
20932,PINK POT PLANT CANDLE,3.75
22251,BIRDHOUSE DECORATION MAGIC GARDEN,1.25
M,Manual,803.25
84801B,WHITE HYDRANGEA ART FLOWER,2.1
POST,POSTAGE,22.0
22191,EAU DE NIL DINER WALL CLOCK,7.65
84877A,PINK ROUND COMPACT MIRROR,3.75
84856L,LARGE TAHITI BEACH BAG,5.95
47310M,"SMALL POP BOX,FUNKY MONKEY",1.25
D,Discount,6.85
21661,VINTAGE GLASS TEA CADDY,5.95
44091C,MULTICOLOUR CRUSOE CHECK LAMPSHADE,0.42
21525,BEWARE OF THE CAT DOORMAT,6.75
20823,GOLD WINE GOBLET,4.65
21315,LARGE GLASS HEART TRINKET POT,4.25
TEST002,This is a test product.,1.0
22243,"HOOK, 5 HANGER ,MAGIC TOADSTOOL RED",1.45
22244,"HOOK, 3 HANGER ,MAGIC GARDEN",1.65
22282,12 EGG HOUSE PAINTED WOOD,10.95
22283,6 EGG HOUSE PAINTED WOOD,6.95
21717,EASTER TIN BUCKET,2.1
22146,EASTER CRAFT IVY WREATH WITH CHICK,1.65
22148,EASTER CRAFT 4 CHICKS ,1.65
22285,"DECORATION HEN ON NEST, HANGING",1.45
22292,"SPRING DEC , HANGING CHICK  YELLOW",1.25
35915B,BLUE KNITTED HEN ,1.27
35915A,CREAM KNITTED HEN,1.27
35915C,PEACH KNITTED HEN ,1.27
21482,MUSHROOM BLUE HOT WATER BOTTLE,2.55
10123C,HEARTS WRAPPING TAPE ,0.53
21390,FILIGRIS HEART WITH BUTTERFLY,1.06
21564,PINK  HEART SHAPE LOVE BUCKET ,2.55
22231,JIGSAW TREE WITH BIRDHOUSE,1.25
84748,FOLK FELT HANGING MULTICOL GARLAND,2.95
21385,IVORY HANGING DECORATION  HEART,0.72
85194L,HANGING SPRING FLOWER EGG LARGE,0.72
85189,HANGING BUTTERFLY  EGG,0.72
85195,HANGING HEART BASKET,1.69
84975,HEART SHAPED MIRROR,1.45
21985,PACK OF 12 HEARTS DESIGN TISSUES ,0.25
85184C,S/4 VALENTINE DECOUPAGE HEART BOX,2.55
40002,WHITE BAMBOO RIBS LAMPSHADE,0.85
71270,PHOTO CLIP LINE,1.25
84838,ANT WHITE HIGH RISE BIRD BOX,8.5
84661B,BLACK SQUARE TABLE CLOCK,2.55
21555,CERAMIC STRAWBERRY TRINKET TRAY,2.25
21198,WHITE HEART CONFETTI IN TUBE,1.65
21343,GOLD JEWELERY BOX,3.95
44092C,PURPLE/COPPER HANGING LAMPSHADE,0.85
72799C,PINK PILLAR CANDLE SILVER FLOCK,1.25
20784,RED RETRO BAR STOOL,39.95
84968A,S/16 VINTAGE ROSE CUTLERY,10.95
84968C,S/16 VINTAGE PISTACHIO CUTLERY,10.95
48103,DOOR MAT KISS MY.......,6.75
20840,FRENCH FLORAL CUSHION COVER ,2.95
84657,GREEN ROSE CUSHION COVER,5.95
21852,EMPIRE TEDDY,6.95
35980B,RED TOP SCANDINAVIAN HEART ,0.38
35004G,SET OF 3 GOLD FLYING DUCKS,5.4
85162A,SILVER RETRODISC LAMPSHADE,8.46
21143,ANTIQUE GLASS HEART DECORATION ,0.0
35603B,S/16 BLACK SHINY/MAT BAUBLES,0.42
22353,LUNCHBOX WITH CUTLERY FAIRY CAKES ,2.1
21666, RIDGED GLASS T-LIGHT HOLDER,0.65
79051A,SMOKEY GREY COLOUR D.O.F. GLASS,0.65
72129,COLUMBIAN CANDLE ROUND ,0.65
35598C,WHITE CHRISTMAS TREE 60CM,2.95
84499,BLACK FLOWER CANDLE PLATE,0.85
84858C,PINK RIVIERA HANDBAG,5.95
35945,GOLD CHRISTMAS STOCKING DECORATION,1.95
71101E,STANDING FAIRY POLE SUPPORT ,0.72
21374,MIRRORED WALL ART SKULLS,3.75
84422,PINK/BLUE DISC/MIRROR STRING,0.85
85231L,LAVENDER SCENTED SET/9 T-LIGHTS,0.72
85231E,STRAWBERRY SCENTED SET/9 T-LIGHTS,0.72
21326,AGED GLASS SILVER T-LIGHT HOLDER,0.55
84563B,BLUE & WHITE BREAKFAST TRAY,5.95
85118,HEART T-LIGHT HOLDER,0.38
21062,PARTY INVITES SPACEMAN,0.38
35924,HANGING FAIRY CAKE DECORATION,1.69
21955,UNION JACK GUNS & ROSES  DOORMAT,4.0
21038,SET/4 MODERN VINTAGE COTTON NAPKINS,2.95
90143,SILVER BRACELET W PASTEL FLOWER,7.5
90036E,"FLOWER GLASS GARLD NECKL36""AMETHYST",7.95
51008,AFGHAN SLIPPER SOCK PAIR,2.95
22301,COFFEE MUG CAT + BIRD DESIGN,2.1
M,Manual,547.3
21275,ZINC TOP  2 DOOR WOODEN SHELF ,16.95
90175B,PINK GLASS CHUNKY CHARM BRACELET,8.95
M,Manual,74.1
72131,COLUMBIAN CANDLE RECTANGLE,1.65
72127,COLUMBIAN CANDLE ROUND ,1.06
72132,COLUMBIAN CUBE CANDLE,1.65
84375,SET OF 20 KIDS COOKIE CUTTERS,1.65
84380,SET OF 3 BUTTERFLY COOKIE CUTTERS,1.06
20682,RED SPOTTY CHILDS UMBRELLA,2.75
20681,PINK SPOTTY CHILDS UMBRELLA,2.75
82552,WASHROOM METAL SIGN,1.06
21903,MAN FLU METAL SIGN,1.85
21164,HOME SWEET HOME METAL SIGN ,2.55
21396,RED SPOTTY EGG CUP ,1.06
20728,LUNCH BAG CARS BLUE,1.45
84691,PACK 20 DOLLY PEGS,0.72
22310,KNITTED MUG COSY IVORY COLOUR ,1.45
21786,RAIN HAT WITH RED SPOTS,0.32
51020B,STRIPY DESIGN SHOWER CAP,0.29
M,Manual,68.96
84931A,PINK SCOTTIE DOG W FLOWER PATTERN,2.55
85128,PLANTPOT SINGLE HOOK PISTACHIO,1.69
21904,HOUSE WRECKING METAL SIGN ,1.85
20804,GLASS CHICKEN BUTTER DISH,1.45
72755C,FLOWER FAIRY OIL BURNER SET ROSE,1.25
21986,PACK OF 12 PINK SPOT TISSUES ,0.25
51020A,SUMMER FUN DESIGN SHOWER CAP,0.29
84247H,PACK/12 DECOUPAGE CARD,2.95
22039,BOTANICAL LILY GIFT WRAP,0.42
22038,BOTANICAL LAVENDER GIFT WRAP ,0.42
84673B,BLUE FLY SWAT,0.65
20885,BOX OF 3 PEBBLE CANDLES,2.95
21366,MIRRORED WALL ART PHOTO FRAMES,3.75
85023B,EAU DE NILE JEWELLED PHOTOFRAME,2.1
85167B,BLACK GRAND BAROQUE PHOTO FRAME,3.39
21908,CHOCOLATE THIS WAY METAL SIGN,1.49
21175,GIN + TONIC DIET METAL SIGN,1.49
84839,SWEETHEART KEY CABINET,3.38
85066,CREAM SWEETHEART MINI CHEST,7.93
21735,TWO DOOR CURIO CABINET,7.3
22091,EMPIRE TISSUE BOX,1.06
90165B,WHITE ROSEBUD  PEARL EARRINGS,2.55
90014A,SILVER/MOP ORBIT NECKLACE,9.95
90014B,GOLD M PEARL  ORBIT NECKLACE,9.95
90052,CRACKED GLAZE NECKLACE BROWN,6.95
20952,PORCELAIN CHERUB BELL SMALL,1.25
84748,FOLK FELT HANGING MULTICOL GARLAND,3.75
16162L,THE KING GIFT BAG,0.65
D,Discount,64.37
21369,MIRRORED WALL ART SPLODGES,3.75
22214,CANDLE PLATE LACE WHITE,2.1
22092,BLUE PAISLEY TISSUE BOX,1.25
21355,TOAST ITS - I LOVE YOU ,1.05
84520D,PACK OF 20 FAIRY CAKE PAPER NAPKINS,0.64
84596F,SMALL MARSHMALLOWS PINK BOWL,1.06
84596B,SMALL DOLLY MIX DESIGN ORANGE BOWL,1.06
37112,YELLOW BIRDS FELT DES FOODCOVER,3.75
20868,SILVER FABRIC MIRROR,0.38
20869,GOLD FABRIC MIRROR,0.38
46776A,WOVEN BUBBLE GUM CUSHION COVER,1.25
46776B,WOVEN BERRIES CUSHION COVER ,1.25
46776E,WOVEN CANDY CUSHION COVER ,1.25
46776C,WOVEN FROST CUSHION COVER,1.25
46776F,WOVEN ROSE GARDEN CUSHION COVER ,1.25
78124,MAGAZINE RACK GEBRA ASSORTED ,1.25
79336,LIGHT PINK FLOCK GLASS CANDLEHOLDER,0.38
79337,BLUE FLOCK GLASS CANDLEHOLDER,0.38
85167B,BLACK GRAND BAROQUE PHOTO FRAME,1.25
85183A,CHARLIE & LOLA WASTEPAPER BIN BLUE,1.25
85183B,CHARLIE & LOLA WASTEPAPER BIN FLORA,1.25
47347B,BLUE FLOWER T-LIGHT HOLDER,0.38
84596J,MIXED NUTS LIGHT GREEN BOWL,1.25
21420,OYSTER TRINKET BOX,3.25
21442,GREEN BIRDHOUSE DECORATION,0.85
84292B,BLUE COL METAL FOLDING CHAIR,7.95
85195,HANGING HEART BASKET,2.1
85203,HANGING WOOD AND FELT BUTTERFLY ,0.42
22261,FELT EGG COSY WHITE RABBIT ,0.85
21275,ZINC TOP  2 DOOR WOODEN SHELF ,2.95
17129C,SKY BLUE COLOUR GLASS GEMS IN BAG,0.85
POST,POSTAGE,50.0
22365,DOORMAT RESPECTABLE HOUSE,6.75
22366,DOORMAT AIRMAIL ,6.75
22196,HEART MEASURING SPOONS SMALL,0.85
35654,VINTAGE BEAD FILLED PINK CUSHION,4.95
85145,JARDIN ETCHED GLASS LARGE BELL JAR,12.75
20933,YELLOW POT PLANT CANDLE,1.25
82616B,FRAPPUCINO SCARF KNITTING KIT,1.25
20688,BEAUTY SPEED EXPRESSO CUPS,1.95
85219,S/4 HEART CRYSTAL FRIDGE MAGNETS,1.65
37451,CERAMIC CAKE TEAPOT WITH CHERRY,4.25
22060,LARGE CAKE STAND HANGING HEARTS,8.5
22165,"DIAMANTE HEART SHAPED WALL MIRROR, ",10.95
21253,SET OF PICTURE FRAME  STICKERS,1.25
85130C,BEADED CRYSTAL HEART BLUE  LARGE,1.65
20736,PINK MINI TAPE MEASURE ,0.72
84674,FLYING PIG WATERING CAN,2.95
84614C,BLUE BAROQUE FLOCK CANDLE HOLDER,5.95
21772,VINTAGE METAL CAKE STAND CREAM ,12.75
84804B,BLUE DELPHINIUM ARTIFICIAL FLOWER,2.95
48138,DOOR MAT UNION FLAG,4.0
48173C,DOOR MAT BLACK FLOCK ,4.0
48188,DOOR MAT WELCOME PUPPIES,4.0
84801A,PINK HYDRANGEA ART FLOWER,2.1
84798A,PINK FOXGLOVE ARTIIFCIAL FLOWER,2.55
84798C,WHITE FOXGLOVE ARTIIFCIAL FLOWER,2.55
22288,"DECORATION , HANGING METAL RABBIT",1.25
85194S,HANGING SPRING FLOWER EGG SMALL,0.65
21363,HOME SMALL WOOD LETTERS,4.95
22217,T-LIGHT HOLDER HANGING LACE,1.06
72800B,S/4 PURPLE DINNER CANDLE BLK FLOCK,2.1
84750A,PINK SMALL GLASS CAKE STAND,1.65
85087,CANDY SPOT CUSHION COVER,2.95
47503J,SET/3 FLORAL GARDEN TOOLS IN BAG,3.95
47503K,ASSORTED FLORAL SECATEURS,0.85
85019A,ROMANTIC IMAGES NOTEBOOK SET,1.25
17091J,VANILLA INCENSE IN TIN,0.38
17091A,LAVENDER INCENSE IN TIN,0.38
85169B,BLACK LOVE BIRD CANDLE,1.25
21955,  DOORMAT UNION JACK GUNS AND ROSES,6.75
90096,NECKLACE+BRACELET SET BLUE BLOSSOM,2.55
90098,NECKLACE+BRACELET PINK BUTTERFLY,2.55
84967B,BLUE KASHMIRI OCCASIONAL TABLE,79.95
20850,ZINC HEART LATTICE PLANTER BOWL,2.95
20981,12 PENCILS TALL TUBE WOODLAND,0.72
16033,MINI HIGHLIGHTER PENS,0.09
22210,WOOD STAMP SET BEST WISHES,1.45
90167,BEADED LOVE HEART JEWELLERY SET,0.72
22176,BLUE OWL SOFT TOY,2.55
22175,PINK OWL SOFT TOY,2.55
21249,WOODLAND  HEIGHT CHART STICKERS ,2.55
21680,WOODLAND  STICKERS,0.72
21542,WOODLAND WATER TRANSFER TATTOOS ,0.65
48138,DOOR MAT UNION FLAG,5.95
85031A,ROMANTIC IMAGES SCRAP BOOK SET,1.25
47574B,ENGLISH ROSE SCENTED HANGING HEART,4.25
M,Manual,1.25
16207B,PINK HEART RED HANDBAG,2.95
84974,S/2 ZINC HEART DESIGN PLANTERS,9.95
22358,KINGS CHOICE TEA CADDY ,2.95
85031B,BLOSSOM IMAGES SCRAP BOOK SET,4.95
79320, FLAMINGO LIGHTS,0.0
21381,MINI WOODEN HAPPY BIRTHDAY GARLAND,1.45
22057,CERAMIC PLATE STRAWBERRY DESIGN,1.25
35241,ENAMEL BLUE RIM BISCUIT BIN,4.25
22192,BLUE DINER WALL CLOCK,7.65
21551,CERAMIC BIRDHOUSE BUTTERFLY LARGE,5.45
22357,KINGS CHOICE BISCUIT TIN,4.25
37495,FAIRY CAKE BIRTHDAY CANDLE SET,2.95
84803A,PINK ALLIUM  ARTIFICIAL FLOWER,1.69
84807,RED POPPY ARTIFICIAL FLOWER,1.69
37462B,"PET MUG, BUDGIE",0.42
79144C,PAINTED LIGHTBULB RAINBOW DESIGN,0.42
35912B,WHITE/PINK CHICK DECORATION,1.25
35913B,WHITE/PINK CHICK EASTER DECORATION,0.85
22264,FELT FARM ANIMAL WHITE BUNNY ,0.85
35910B,PINK FLOWERS RABBIT EASTER,1.95
21912,VINTAGE SNAKES & LADDERS,3.39
21749,LARGE RED SPOT WINDMILL,1.85
21974,SET OF 36 PAISLEY FLOWER DOILIES,1.25
21746,SMALL RED SPOT  WINDMILL,1.06
21933,PINK VINTAGE PAISLEY PICNIC BAG,2.55
21932,SCANDINAVIAN PAISLEY PICNIC BAG,2.55
22277,COSMETIC BAG VINTAGE ROSE PAISLEY,1.85
22278,OVERNIGHT BAG VINTAGE ROSE PAISLEY,4.25
22304,COFFEE MUG BLUE PAISLEY DESIGN,2.1
20715,LITTLE FLOWER SHOPPER BAG,1.06
85178,VICTORIAN SEWING KIT,0.85
84805B,BLUE CLIMBING HYDRANGA ART FLOWER,2.95
84798B,PURPLE FOXGLOVE ARTIIFCIAL FLOWER,2.1
84798A,PINK FOXGLOVE ARTIIFCIAL FLOWER,2.1
85176,SEWING SUSAN 21 NEEDLE SET,0.64
37345,ASSTD HEARTS DESIGN MUGS,1.65
21614,SET OF 12 ROSE BOTANICAL T-LIGHTS,2.55
10134,COLOURING PENCILS BROWN TUBE,1.06
10133,COLOURING PENCILS BROWN TUBE,0.72
22193,RED WALL CLOCK,7.65
22191,IVORY WALL CLOCK,7.65
21588,RETRO SPOT GIANT  TUBE MATCHES,2.1
21593,SWALLOW CIGAR BOX MATCHES ,1.06
21592,RETRO SPOT  CIGAR BOX MATCHES ,1.06
21584,RETRO SPOT SMALL TUBE MATCHES,1.45
21937,STRAWBERRY   PICNIC BAG,2.55
21936,RED/WHITE SPOT PICNIC BAG,2.55
37340,MULTICOLOUR SPRING FLOWER MUG,0.64
21215, IVORY PAPER CUP CAKE CASES ,0.42
84279P, CHERRY BLOSSOM  DECORATIVE FLASK,3.39
84279B,CHERRY BLOSSOM DECORATIVE FLASK,3.39
22072,TEA CUP AND SAUCER RETRO SPOT,3.39
21889,WOODEN BOX OF DOMINOES,1.06
20913,SET/5 BLUE SPOTTY LID GLASS BOWLS,2.55
21983,PACK OF 12 BLUE PAISLEY TISSUES ,0.25
21718,RED METAL BEACH SPADE ,1.06
21715,GIRLS VINTAGE TIN SEASIDE BUCKET,2.1
21716,BOYS VINTAGE TIN SEASIDE BUCKET,2.1
21913,VINTAGE SEASIDE JIGSAW PUZZLES,3.39
22128,PARTY CONES CANDY ASSORTED,1.06
22127,PARTY CONES CARNIVAL ASSORTED,1.06
22089,PAPER BUNTING VINTAGE PAISLEY,2.55
22175,PINK OWL DECORATION,2.55
22176,BLUE OWL DECORATION,2.55
22323,BAG FOR CHILDREN VINTAGE PINK ,4.25
22324,BAG FOR CHILDREN VINTAGE BLUE ,4.25
85206B,PINK FELT EASTER EGG BASKET,1.45
21437,24 HANGING EASTER EGGS FLORAL TUB,2.95
21438,TUB 24 HANGING EASTER EGGS SPOTTY,2.95
72750A,"F.FAIRY S/3 CANDLE/GLASS,LILY/VALLY",5.95
72750B,"F.FAIRY S/3 CANDLE/GLASS,LAVENDER",5.95
84856S,SMALL TAHITI BEACH BAG,4.65
62096A,PINK/YELLOW FLOWERS HANDBAG,1.95
62096B,PURPLE/TURQ FLOWERS HANDBAG,1.95
84611B,BLACK NEW BAROQUE FLOCK BOX,5.95
79403,FROSTED WHITE BASE ,0.85
20839,FRENCH PAISLEY CUSHION COVER ,2.95
85163B,BLACK BAROQUE WALL CLOCK ,12.75
90144,SILVER DROP EARRINGS WITH FLOWER,3.75
21257,VICTORIAN SEWING BOX MEDIUM,6.6
POST,POSTAGE,7.06
84508A,CAMOFLAGE DESIGN TEDDY,2.1
79340W,WHITE ORCHID FLOWER LIGHTS,6.75
22326,"ROUND SNACK BOXES ,SET4, WOODLAND ",2.95
22328,"ROUND SNACK BOXES ,SET 4, FRUITS ",2.95
21562,HAWAIIAN GRASS SKIRT ,2.1
21344,MOROCCAN BEATEN METAL DISH,3.95
POST,POSTAGE,1.0
21322,GLASS SPHERE CANDLE STAND LARGE ,6.35
84917,WHITE HAND TOWEL WITH BUTTERFLY,5.95
82011C,BATHROOM SCALES FOOTPRINTS IN SAND,2.95
84867A,PINK BABY GIRLS PHOTO ALBUM,5.95
20794,BLUE  TILE HOOK,2.55
85091,CANDY SPOT BREAD BASKETS,4.95
21156,RED SPOTTY CHILDS APRON,1.65
16258A,SWIRLY CIRCULAR RUBBERS IN BAG,0.42
47503J,SET/3 FLORAL GARDEN TOOLS IN BAG,6.35
70006,LOVE HEART POCKET WARMER,1.25
M,Manual,780.52
47587A,PINK FAIRY CAKE COASTER,0.85
84762A,WHITE PICNIC BARBECUE BUCKET,10.75
22355,"CHARLOTTE BAG , SUKI DESIGN",0.0
20616,CHERRY BLOSSOM PASSPORT COVER,2.1
21110,LARGE CAKE TOWEL PINK SPOTS,5.95
POST,POSTAGE,180.0
40016,CHINESE DRAGON PAPER LANTERNS,0.25
21276,TWO EMBOSSED HEART MINI DRAWERS,5.95
21779,MA CAMPAGNE MINI WOODEN CHEST,7.36
21780,MA CAMPAGNE 4 DRAWER WALL SHELF,12.75
20748,KENSINGTON COFFEE SET,10.95
84612B,SET/4 BLACK  BAROQUE FLOCK COASTER,2.55
84464,S/60 PINK FLUFFY CHICKS IN BOX,2.55
21318,GLASS CHALICE BLUE SMALL ,1.45
21321,GLASS CHALICE BLUE  LARGE ,2.1
84032B,CHARLIE + LOLA RED HOT WATER BOTTLE,2.55
85103, SILVER T-LIGHT SETTING,5.95
84250M,"GREETING CARD, BLACKPOOL ROCK",0.19
84984A,GREEN PEONY DES C/COVER,4.65
84984B,RED PEONY DES C/COVER ,4.65
21393,BLUE  SPOTTY PUDDING BOWL,2.1
21780,MA CAMPAGNE 4 DRAWER WALL SHELF,5.0
22366,DOORMAT AIRMAIL ,5.95
22365,DOORMAT RESPECTABLE HOUSE,5.95
21955,  DOORMAT UNION JACK GUNS AND ROSES,5.95
22066,LOVE HEART TRINKET POT,1.25
72739C,DARK CHOCOLATE SCENTCANDLE,0.65
22289,"DECORATION , HANGING METAL CHICKEN",1.25
22329,ROUND CONTAINER SET OF 5 RETROSPOT,1.65
22367,CHILDS APRON SPACEBOY DESIGN,1.95
17136A,BLUE STONES ON WIRE FOR CANDLE,0.21
22414,DOORMAT NEIGHBOURHOOD WITCH ,6.75
21935,SUKI  SHOULDER BAG,1.45
21828,EIGHT PIECE SNAKE  SET,1.06
84509A,ENGLISH ROSE PLACEMATS,2.95
21042,RED SPOTTY APRON ,4.65
22202,MILK PAN PINK RETROSPOT,3.39
22200,FRYING PAN PINK POLKADOT ,3.75
21826,EIGHT PIECE DINOSAUR SET,1.06
84876B,GREEN HEART COMPACT MIRROR,1.25
85132B,CHARLIE AND LOLA TABLE TINS,8.95
85132A,CHARLIE + LOLA BISCUITS TINS,8.95
85172,HYACINTH BULB T-LIGHT CANDLES,0.36
22327,ROUND SNACK BOXES SET OF 4 SKULLS,2.95
22328,ROUND SNACK BOXES SET OF 4 FRUITS ,2.95
16156L,"WRAP, CAROUSEL",0.42
22326,ROUND SNACK BOXES SET OF4 WOODLAND ,2.95
84510B,SET OF 4 FAIRY CAKES COASTERS ,1.06
21709,FOLDING UMBRELLA  CHOC/WHITE  SPOT,4.25
21707,"FOLDING UMBRELLA , BLACK/BLUE  SPOT",4.25
16048,TEATIME ROUND PENCIL SHARPENER ,0.12
22357,KINGS CHOICE BISCUIT TIN,3.75
22358,KINGS CHOICE TEA CADDY ,2.55
22023,EMPIRE BIRTHDAY CARD,0.36
35922,EASTER BUNNY WREATH,4.95
22252,BIRDCAGE DECORATION TEALIGHT HOLDER,1.25
47599B,BLUE PARTY BAGS ,2.1
M,Manual,17.6
84843,WHITE SOAP RACK WITH 2 BOTTLES,5.95
22241,GARLAND WOODEN HAPPY EASTER,1.25
85188A,GREEN METAL SWINGING BUNNY,0.85
M,Manual,975.11
M,Manual,435.88
20753,RETRO PINK SPOT WASHING UP GLOVES,0.5
85188B,PINK METAL SWINGING BUNNY,0.85
17096,ASSORTED LAQUERED INCENSE HOLDERS,0.17
35160,BUDDHA INCENSE HOLDER ASSORTED,0.72
72606A,BROWN ANTIQUE CUBE CANDLE,0.42
47583A,SET OF 3 WICKER BASKET ROSE,24.95
21185, HOME SWEET HOME  BLACKBOARD,5.49
84595E,LARGE TORTILLA DESIGN RED BOWL,1.65
21408,SPOTTY PINK DUCK DOORSTOP,3.75
20712,JUMBO BAG WOODLAND ANIMALS,1.65
84706D,CHERRY BLOSSOM TABLE CLOCK ,1.95
84856S,SMALL TAHITI BEACH BAG,3.81
21368,MIRRORED WALL ART LADIES,2.55
21253,SET OF PICTURE FRAME  STICKERS,2.55
21367,MIRRORED WALL ART GENTS,2.55
47590B,PINK HAPPY BIRTHDAY BUNTING,4.65
21652,GLASS ETCHED T-LIGHT HOLDER MEDIUM,1.65
46138B,BLUE CHENILLE SHAGGY CUSHION COVER ,1.95
85110,BLACK SILVER FLOWER T-LIGHT HOLDER,0.85
84925F,PSYCHEDELIC WALL THERMOMETER,1.7
84925E,FLOWERS WALL THERMOMETER,1.7
84925D,LA PALMIERA WALL THERMOMETER,1.7
84925A,WAKE UP COCKEREL WALL THERMOMETER,1.7
21308,LOUVRE VANITY MIRROR,5.0
21309,LOUVRE CHALKBOARD,6.0
21910,WAY OUT METAL SIGN ,1.0
21174,POTTERING IN THE SHED METAL SIGN,1.4
21179,NO JUNK MAIL METAL SIGN,0.7
21164,HOME SWEET HOME METAL SIGN ,2.0
21911,GARDEN METAL SIGN ,1.3
21165,BEWARE OF THE CAT METAL SIGN ,1.0
21548,CERAMIC BIRDHOUSE FINCH BLUE ROOF,2.0
21545,CERAMIC BIRDHOUSE BUTTERFLY SMALL,2.0
21547,CERAMIC BIRDHOUSE CRESTED TIT SMALL,2.0
21552,CERAMIC BIRDHOUSE BLACK ROSE  LARGE,4.0
21551,CERAMIC BIRDHOUSE BUTTERFLY LARGE,4.0
21550,CERAMIC BIRDHOUSE CRESTED TIT LARGE,4.0
21554,CERAMIC BIRDHOUSE RED ROOF LARGE,4.0
21553,CERAMIC BIRDHOUSE FINCH BLUE  LARGE,4.0
21444,BLUE CHALET BIRDFEEDER,2.5
21443,OLIVE CHALET BIRDFEEDER,2.5
22083,PAPER CHAIN KIT RETRO SPOT,2.0
22084,PAPER CHAIN KIT EMPIRE,2.0
22089,PAPER BUNTING VINTAGE PAISLEY,2.0
22088,PAPER BUNTING COLOURED LACE,2.0
22090,PAPER BUNTING RETRO SPOTS,2.0
21338,MARAKESH LANTERN SMALL ,4.0
84767,ZINC POLICE BOX LANTERN,4.0
21324,HANGING MEDINA LANTERN SMALL,2.0
21323,HANGING MEDINA LANTERN LARGE,2.8
21728,METAL MEDINA LANTERN ,8.0
85119,WATERING CAN SINGLE HOOK PISTACHIO,1.1
85128,PLANTPOT SINGLE HOOK PISTACHIO,1.1
