product_id,product_name,price
85048,15CM CHRISTMAS GLASS BALL 20 LIGHTS,6.95
79323P,PINK CHERRY LIGHTS,6.75
79323W, WHITE CHERRY LIGHTS,6.75
22041,"RECORD FRAME 7"" SINGLE SIZE ",2.1
21232,STRAWBERRY CERAMIC TRINKET BOX,1.25
22064,PINK DOUGHNUT TRINKET POT ,1.65
21871,SAVE THE PLANET MUG,1.25
21523,FANCY FONT HOME SWEET HOME DOORMAT,5.95
22350,CAT BOWL ,2.55
22349,"DOG BOWL , CHASING BALL DESIGN",3.75
22195,HEART MEASURING SPOONS LARGE,1.65
22353,LUNCHBOX WITH CUTLERY FAIRY CAKES ,2.55
48173C,DOOR MAT BLACK FLOCK ,5.95
21755,LOVE BUILDING BLOCK WORD,5.45
21754,HOME BUILDING BLOCK WORD,5.95
84879,ASSORTED COLOUR BIRD ORNAMENT,1.69
22119, PEACE WOODEN BLOCK LETTERS,6.95
22142,CHRISTMAS CRAFT WHITE FAIRY ,1.45
22296,HEART IVORY TRELLIS LARGE,1.65
22295,HEART FILIGREE DOVE LARGE,1.65
22109,FULL ENGLISH BREAKFAST PLATE,3.39
22107,PIZZA PLATE IN BOX,3.75
22194,BLACK DINER WALL CLOCK,8.5
35004B,SET OF 3 BLACK FLYING DUCKS,4.65
82582,AREA PATROLLED METAL SIGN,2.1
21181,PLEASE ONE PERSON  METAL SIGN,2.1
21756,BATH BUILDING BLOCK WORD,5.95
21333,CLASSIC WHITE FRAME,2.95
84596F,SMALL MARSHMALLOWS PINK BOWL,1.25
84596L,BISCUITS SMALL BOWL LIGHT BLUE,1.25
22111,SCOTTIE DOG HOT WATER BOTTLE,4.25
22143,CHRISTMAS CRAFT HEART DECORATIONS,2.1
22145,CHRISTMAS CRAFT HEART STOCKING ,2.1
22130,PARTY CONE CHRISTMAS DECORATION ,0.85
21364,PEACE SMALL WOOD LETTERS,6.75
21360,JOY LARGE WOOD LETTERS,9.95
21351,CINAMMON & ORANGE WREATH,6.75
21352,EUCALYPTUS & PINECONE  WREATH,6.75
35400,WOODEN BOX ADVENT CALENDAR ,8.95
20695,FLORAL BLUE MONSTER,4.25
37370,RETRO COFFEE MUGS ASSORTED,1.25
10002,INFLATABLE POLITICAL GLOBE ,0.85
84507B,STRIPES DESIGN MONKEY DOLL,2.55
20703,BLUE PADDED SOFT MOBILE,4.25
21987,PACK OF 6 SKULL PAPER CUPS,0.65
21989,PACK OF 20 SKULL PAPER NAPKINS,0.85
84970S,HANGING HEART ZINC T-LIGHT HOLDER,0.85
20971,PINK BLUE FELT CRAFT TRINKET BOX,1.25
22271,FELTCRAFT DOLL ROSIE,2.95
22272,FELTCRAFT DOLL MARIA,2.95
22274,FELTCRAFT DOLL EMILY,2.95
21912,VINTAGE SNAKES & LADDERS,3.75
22111,SCOTTIE DOG HOT WATER BOTTLE,4.95
22112,CHOCOLATE HOT WATER BOTTLE,4.95
21329,DINOSAURS  WRITING SET ,0.98
21252,SET OF MEADOW  FLOWER STICKERS,1.69
21100,CHARLIE AND LOLA CHARLOTTE BAG,1.15
21033,JUMBO BAG CHARLIE AND LOLA TOYS,2.0
20711,JUMBO BAG TOYS ,1.3
21410,COUNTRY COTTAGE  DOORSTOP GREEN,2.5
21411,GINGHAM HEART  DOORSTOP RED,2.5
84031A,CHARLIE+LOLA RED HOT WATER BOTTLE ,3.0
84031B,CHARLIE LOLA BLUE HOT WATER BOTTLE ,3.0
84032A,CHARLIE+LOLA PINK HOT WATER BOTTLE,1.9
84032B,CHARLIE + LOLA RED HOT WATER BOTTLE,1.9
84519A,TOMATO CHARLIE+LOLA COASTER SET,2.15
84519B,CARROT CHARLIE+LOLA COASTER SET,2.4
85132A,CHARLIE + LOLA BISCUITS TINS,6.38
85132C,CHARLIE AND LOLA FIGURES TINS,6.4
85183A,CHARLIE & LOLA WASTEPAPER BIN BLUE,2.4
85183B,CHARLIE & LOLA WASTEPAPER BIN FLORA,2.4
22065,CHRISTMAS PUDDING TRINKET POT ,1.45
22138,BAKING SET 9 PIECE RETROSPOT ,4.95
22139,RETRO SPOT TEA SET CERAMIC 11 PC ,4.95
22352,LUNCHBOX WITH CUTLERY RETROSPOT ,2.55
85014A,BLACK/BLUE DOTS RUFFLED UMBRELLA,5.95
85014B,RED/WHITE DOTS RUFFLED UMBRELLA,5.95
16161P,WRAP ENGLISH ROSE ,0.42
16169N,WRAP BLUE RUSSIAN FOLKART,0.42
21491,SET OF THREE VINTAGE GIFT WRAPS,1.95
22333,RETRO SPORT PARTY BAG + STICKER SET,1.65
85216,ASSORTED CAKES FRIDGE MAGNETS,0.65
21493, VINTAGE DESIGN GIFT TAGS,0.85
21731,RED TOADSTOOL LED NIGHT LIGHT,1.65
85232B,SET/3 RUSSIAN DOLL STACKING TINS,4.95
84691,PACK 20 DOLLY PEGS,0.85
20749,ASSORTED COLOUR MINI CASES,7.95
POST,POSTAGE,18.0
22321,BIRD DECORATION RED SPOT,0.72
22138,BAKING SET 9 PIECE RETROSPOT ,4.25
84029E,RED WOOLLY HOTTIE WHITE HEART.,2.95
21955,UNION JACK GUNS & ROSES  DOORMAT,6.75
84899E,YELLOW + BROWN BEAR FELT PURSE KIT,1.25
85123A,WHITE HANGING HEART T-LIGHT HOLDER,2.95
21582,KINGS CHOICE SMALL TUBE MATCHES,1.65
21586,KINGS CHOICE GIANT TUBE MATCHES,2.55
21590,KINGS CHOICE CIGAR BOX MATCHES ,1.25
22091,EMPIRE TISSUE BOX,1.25
84251J,"GREETING CARD, THE BLACK CAT",0.42
22024,RAINY LADIES BIRTHDAY CARD,0.42
22026,BANQUET BIRTHDAY  CARD  ,0.42
22029,SPACE BOY BIRTHDAY CARD,0.42
22025,RING OF ROSES BIRTHDAY CARD,0.42
22031,BOTANICAL LAVENDER BIRTHDAY CARD,0.42
21428,SET3 BOOK BOX GREEN GINGHAM FLOWER ,4.25
21430,SET/3 RED GINGHAM ROSE STORAGE BOX,3.75
21916,SET 12 RETRO WHITE CHALK STICKS,0.42
21790,VINTAGE SNAP CARDS,0.85
21888,BINGO SET,3.75
85178,VICTORIAN SEWING KIT,1.25
20754,RETRO RED SPOTTY WASHING UP GLOVES,2.1
21035,SET/2 RED SPOTTY TEA TOWELS ,2.95
82001S,VINYL RECORD FRAME SILVER,3.39
82580,BATHROOM METAL SIGN,0.55
85150,LADIES & GENTLEMEN METAL SIGN,2.55
21041,RED SPOTTY OVEN GLOVE DOUBLE,2.95
POST,POSTAGE,141.0
35916C,PINK FELT HANGING HEART W FLOWER,0.85
35916B,BLUE FELT HANGING HEART W FLOWER,0.85
22321,BIRD DECORATION RED SPOT,0.85
22180,RETRO SPOT LAMP,9.95
22128,PARTY CONES CANDY ASSORTED,1.25
22163,HEART STRING MEMO HOLDER HANGING,2.95
35951,FOLKART BAUBLE CHRISTMAS DECORATION,0.38
22253,6 CROCHET STRAWBERRIES,1.25
84988,SET OF 72 PINK HEART PAPER DOILIES,1.45
22219,LOVEBIRD HANGING DECORATION WHITE ,0.85
18097C,WHITE TALL PORCELAIN T-LIGHT HOLDER,2.55
21299,EDWARDIAN TOILET ROLL UNIT ,12.75
21099,SET/6 STRAWBERRY PAPER CUPS,0.65
21085,SET/6 WOODLAND PAPER CUPS,0.65
21929,JUMBO BAG PINK VINTAGE PAISLEY,1.95
22241,"GARLAND , WOODEN  "" HAPPY EASTER""",1.25
21091,SET/6 WOODLAND PAPER PLATES,0.85
21733,RED HANGING HEART T-LIGHT HOLDER,2.55
85123A,WHITE HANGING HEART T-LIGHT HOLDER,2.55
22178,VICTORIAN GLASS HANGING T-LIGHT,1.25
22125,UNION JACK HOT WATER BOTTLE ,5.95
21671,RED SPOT CERAMIC DRAWER KNOB,1.25
22086,PAPER CHAIN KIT 50'S CHRISTMAS ,2.95
22294,HEART FILIGREE DOVE  SMALL,1.25
22199,FRYING PAN RED POLKADOT ,4.25
22083,PAPER CHAIN KIT RETRO SPOT,2.95
22114,HOT WATER BOTTLE TEA AND SYMPATHY,3.95
21485,RED SPOT HEART HOT WATER BOTTLE,4.95
21928,JUMBO BAG SCANDINAVIAN PAISLEY,1.95
85099B,JUMBO BAG RED WHITE SPOTTY ,1.95
22356,"CHARLOTTE BAG , PINK/WHITE SPOTS",0.85
20724,RED SPOTTY CHARLOTTE BAG,0.85
21592,RETRO SPOT  CIGAR BOX MATCHES ,1.25
20725,LUNCH BAG RED SPOTTY,1.65
20728,LUNCH BAG CARS BLUE,1.65
20726,LUNCH BAG WOODLAND,1.65
21217,RED SPOTTY ROUND CAKE TINS,8.95
22195,LARGE HEART MEASURING SPOONS,1.65
85066,CREAM SWEETHEART MINI CHEST,12.75
POST,POSTAGE,130.0
20827,GOLD APERITIF GLASS,2.12
20825,GOLD WINE GLASS,3.39
20823,GOLD WINE GOBLET,4.25
20826,SILVER APERITIF GLASS,2.12
22087,PAPER BUNTING WHITE LACE,2.95
85206A,CREAM FELT EASTER EGG BASKET,1.65
21895,POTTING SHED SOW 'N' GROW SET,4.25
21896,POTTING SHED TWINE,2.1
84946,ANTIQUE SILVER TEA GLASS ETCHED,1.25
22090,PAPER BUNTING RETRO SPOTS,2.95
90200A,PURPLE SWEETHEART BRACELET,4.25
90200D,PINK SWEETHEART BRACELET,4.25
90200B,BLACK SWEETHEART BRACELET,4.25
90200E,GREEN SWEETHEART BRACELET,4.25
90200C,BLUE SWEETHEART BRACELET,4.25
90185C,BLACK DIAMANTE EXPANDABLE RING,4.25
90185B,AMETHYST DIAMANTE EXPANDABLE RING,4.25
90003C,MIDNIGHT BLUE PAIR HEART HAIR SLIDE,3.75
90003D,CRYSTAL PAIR HEART HAIR SLIDES,3.75
90003B,ROSE COLOUR PAIR HEART HAIR SLIDES,3.75
90209C,PINK ENAMEL+GLASS HAIR COMB,2.1
90209A,PURPLE ENAMEL+GLASS HAIR COMB,2.1
90082D,DIAMANTE BOW BROOCH BLACK COLOUR,6.35
21977,PACK OF 60 PINK PAISLEY CAKE CASES,0.55
84991,60 TEATIME FAIRY CAKE CASES,0.55
22273,FELTCRAFT DOLL MOLLY,2.95
22179,SET 10 LIGHTS NIGHT OWL,6.75
22320,BIRDS MOBILE VINTAGE DESIGN,5.95
22232,3 PIECE JIGSAW TOADSTOOLS,1.65
84598,BOYS ALPHABET IRON ON PATCHES,0.21
79323S, SILVER CHERRY LIGHTS,6.75
84568,GIRLS ALPHABET IRON ON PATCHES ,0.21
21668,RED STRIPE CERAMIC DRAWER KNOB,1.25
21669,BLUE STRIPE CERAMIC DRAWER KNOB,1.25
21670,BLUE SPOT CERAMIC DRAWER KNOB,1.25
21672,WHITE SPOT RED CERAMIC DRAWER KNOB,1.25
21673,WHITE SPOT BLUE CERAMIC DRAWER KNOB,1.25
85071A,BLUE CHARLIE+LOLA PERSONAL DOORSIGN,2.95
85071B,RED CHARLIE+LOLA PERSONAL DOORSIGN,2.95
21161,KEEP OUT BOYS DOOR HANGER ,1.45
21162,TOXIC AREA  DOOR HANGER ,1.45
21248,DOOR HANGER  MUM + DADS ROOM,1.45
21159,MOODY BOY  DOOR HANGER ,1.45
82494L,WOODEN FRAME ANTIQUE WHITE ,2.95
82486,WOOD S/3 CABINET ANT WHITE FINISH,7.95
82483,WOOD 2 DRAWER CABINET WHITE FINISH,5.95
21212,PACK OF 72 RETRO SPOT CAKE CASES,0.55
72756,FAIRY CAKE CANDLES,1.49
22063,CERAMIC BOWL WITH STRAWBERRY DESIGN,2.95
37450,CERAMIC CAKE BOWL + HANGING CAKES,2.95
21707,"FOLDING UMBRELLA , BLACK/BLUE  SPOT",4.95
21710,FOLDING UMBRELLA  PINK/WHITE  SPOT,4.95
21708,FOLDING UMBRELLA  CREAM/MULTI  SPOT,4.95
21706,"FOLDING UMBRELLA , RED/WHITE SPOT",4.95
21711,FOLDING UMBRELLA  WHITE/RED  SPOT,4.95
20747,PICCADILLY TEA SET,14.95
21733,RED HANGING HEART T-LIGHT HOLDER,2.95
20752,RETRO BLUE SPOTTY WASHING UP GLOVES,2.1
20753,RETRO PINK SPOT WASHING UP GLOVES,2.1
20751,FUNKY WASHING UP GLOVES ASSORTED,2.1
48185,DOOR MAT FAIRY CAKE,6.75
21481,FAWN BLUE HOT WATER BOTTLE,2.95
85042,ANTIQUE LILY FAIRY LIGHTS,4.25
72760B,VINTAGE CREAM 3 BASKET CAKE STAND,9.95
84879,ASSORTED COLOUR BIRD ORNAMENT,1.45
22149,FELTCRAFT 6 FLOWER FRIENDS,2.1
84031B,CHARLIE LOLA BLUE HOT WATER BOTTLE ,4.65
84032A,CHARLIE+LOLA PINK HOT WATER BOTTLE,2.95
84032B,CHARLIE + LOLA RED HOT WATER BOTTLE,2.95
21482,MUSHROOM BLUE HOT WATER BOTTLE,2.95
21484,CHICK GREY HOT WATER BOTTLE,3.45
20967,GREY FLORAL FELTCRAFT SHOULDER BAG,3.75
20970,PINK FLORAL FELTCRAFT SHOULDER BAG,3.75
21100,CHARLIE AND LOLA CHARLOTTE BAG,1.65
84582,PINK CROCHET CAT WITH SCARF,4.25
20972,PINK CREAM FELT CRAFT TRINKET BOX ,1.25
84327A,PINK JUMPER LARRY THE LAMB,2.1
21490,SET OF THREE 50'S GIFT WRAPS ,1.95
21063,PARTY INVITES JAZZ HEARTS,0.85
21058,PARTY INVITES WOODLAND,0.85
84997D,PINK 3 PIECE MINI DOTS CUTLERY SET,3.75
84997C,BLUE 3 PIECE MINI DOTS CUTLERY SET,3.75
22301,COFFEE MUG CAT + BIRD DESIGN,2.55
22300,COFFEE MUG DOG + BALL DESIGN,2.55
21231,SWEETHEART CERAMIC TRINKET BOX,1.25
20870,OPULENT VELVET CANDLE IN BOX,2.1
90121B,VINTAGE ROSE BEAD BRACELET BLUE,4.25
90175A,WHITE GLASS CHUNKY CHARM BRACELET,8.95
90195B,BLACK GEMSTONE BRACELET,8.95
90062,CARNIVAL BRACELET,12.75
21930,JUMBO STORAGE BAG SKULLS,1.95
21540,DAIRY MAID CERAMIC BUTTER DISH,4.25
21533,RETRO SPOT LARGE MILK JUG,4.95
85083,KISS REINDEER SCANDINAVIAN STOCKING,2.55
21472,LADYBIRD + BEE RAFFIA FOOD COVER,3.75
48185,DOOR MAT FAIRY CAKE,5.95
47566B,TEA TIME PARTY BUNTING,4.65
22275,WEEKEND BAG VINTAGE ROSE PAISLEY,8.5
21479,WHITE SKULL HOT WATER BOTTLE ,3.75
21791,VINTAGE HEADS AND TAILS CARD GAME ,1.06
84032A,CHARLIE+LOLA PINK HOT WATER BOTTLE,2.55
71477,COLOUR GLASS. STAR T-LIGHT HOLDER,2.75
37449,CERAMIC CAKE STAND + HANGING CAKES,8.5
37446,MINI CAKE STAND WITH HANGING CAKES,1.25
21955,UNION JACK GUNS & ROSES  DOORMAT,5.95
21258,VICTORIAN SEWING BOX LARGE,10.95
20892,SET/3 TALL GLASS CANDLE HOLDER PINK,3.95
47591D,PINK FAIRY CAKE CHILD'S APRON,1.65
21867,PINK UNION JACK  LUGGAGE TAG,1.25
82551,LAUNDRY 15C METAL SIGN,1.25
82567,"AIRLINE LOUNGE,METAL SIGN",2.1
82613D,METAL SIGN CUPCAKE SINGLE HOOK,1.25
21179,NO JUNK MAIL METAL SIGN,1.25
21865,PINK UNION JACK  PASSPORT COVER ,2.1
72783,BLACK SIL'T SQU CANDLE PLATE ,2.1
20719,WOODLAND CHARLOTTE BAG,0.85
21869,POTTING SHED COFFEE MUG,1.25
21876,POTTERING MUG,1.25
84849B,FAIRY SOAP SOAP HOLDER,1.69
21864,UNION JACK FLAG PASSPORT COVER ,2.1
21470,FLOWER VINE RAFFIA FOOD COVER,3.75
20897,VINTAGE NOTEBOOK PARIS DAYS,2.95
44230,SQUARE MIRROR CURTAIN,7.95
37485,ENGLISH ROSE TEA SET IN GIFT BOX,4.65
84997A,GREEN 3 PIECE MINI DOTS CUTLERY SET,3.75
21245,GREEN  SPOTTY PLATE ,1.69
21241,GREEN SPOTTY CUP,0.85
21705,BAG 500g SWIRLY MARBLES,1.65
21913,VINTAGE SEASIDE JIGSAW PUZZLES,3.75
16207A,PINK STRAWBERRY HANDBAG ,2.95
21821,GLITTER STAR GARLAND WITH BELLS ,3.75
22319,HAIRCLIPS FORTIES FABRIC ASSORTED,0.65
21584,RETRO SPOT SMALL TUBE MATCHES,1.65
21791,VINTAGE HEADS AND TAILS CARD GAME ,1.25
21931,JUMBO STORAGE BAG SUKI,1.95
20711,JUMBO BAG TOYS ,1.95
47591A,CAROUSEL DES CHILD'S APRON,1.65
84997B,RED 3 PIECE MINI DOTS CUTLERY SET,3.75
22122,SET OF 2 FANCY FONT TEA TOWELS,2.95
21252,SET OF MEADOW  FLOWER STICKERS,2.95
21837,CROSS STITCH ALPHABET CUSHION COVER,5.95
84951A,S/4 PISTACHIO LOVEBIRD COASTERS,2.55
22335,HEART DECORATION PAINTED ZINC ,0.65
85129A,"WHITE PEARL BEADED HEART, SMALL",1.25
84791,GINGHAM HEART DECORATION,2.95
21244,BLUE  SPOTTY PLATE ,1.69
20675,BLUE SPOTTY BOWL,1.25
20892,SET/3 TALL GLASS CANDLE HOLDER PINK,12.75
85048,15CM CHRISTMAS GLASS BALL 20 LIGHTS,7.95
82616B,FRAPPUCINO SCARF KNITTING KIT,2.95
22276,WASH BAG VINTAGE ROSE PAISLEY,2.55
84912B,GREEN ROSE WASHBAG,3.75
85014C,BLUE/BROWN DOTS RUFFLED UMBRELLA,5.95
85014D,PINK/BROWN DOTS RUFFLED UMBRELLA,5.95
21326,AGED GLASS SILVER T-LIGHT HOLDER,0.65
84949,SILVER HANGING T-LIGHT HOLDER,1.65
21908,CHOCOLATE THIS WAY METAL SIGN,2.1
21371,MIRRORED WALL ART POPPIES,2.55
85152,HAND OVER THE CHOCOLATE   SIGN ,2.1
21133,PAINTED BIRD ASSORTED CHRISTMAS,1.69
20984,12 PENCILS TALL TUBE POSY,0.85
20982,12 PENCILS TALL TUBE SKULLS,0.85
84971L,LARGE HEART FLOWERS HOOK   ,1.25
90168,2 DAISIES HAIR COMB,2.95
84884A,ANT WHITE WIRE HEART SPIRAL,3.95
90013C,GREEN VINTAGE EARRINGS ,3.75
90023,FILIGREE DIAMANTE EARRINGS,4.25
90067A,PINK VINTAGE VICTORIAN EARRINGS,2.95
90067B,BROWN VINTAGE VICTORIAN EARRINGS,2.95
90145,SILVER HOOP EARRINGS WITH FLOWER,5.95
90000A,RASPBERRY ANT COPPER FLOWER NECKLAC,5.95
90024B,NEW BAROQUE B'FLY NECKLACE RED,8.5
90036D,"FLOWER GLASS GARLAND NECKL.36""BLACK",7.95
90134,OLD ROSE COMBO BEAD NECKLACE,2.95
90131,PINK/AMETHYST/GOLD NECKLACE,6.95
90199C,5 STRAND GLASS NECKLACE CRYSTAL,6.35
35751C,PURPLE CURRENT CANDLE RING,0.75
72739B,WHITE CHOCOLATE SCENT CANDLE,1.25
22212,FOUR HOOK  WHITE LOVEBIRDS,2.1
21523,FANCY FONT HOME SWEET HOME DOORMAT,6.75
48187,DOOR MAT NEW ENGLAND,6.75
48195,DOOR MAT GREEN PAISLEY ,6.75
72741,GRAND CHOCOLATECANDLE,1.45
85232D,SET/3 DECOUPAGE STACKING TINS,4.95
20828,GLITTER BUTTERFLY CLIPS,2.55
22080,RIBBON REEL SPOTS DESIGN ,1.65
22082,RIBBON REEL STRIPES DESIGN ,1.65
21784,SHOE SHINE BOX ,9.95
21172,PARTY METAL SIGN ,1.45
82600,NO SINGING METAL SIGN,2.1
22282,12 EGG HOUSE PAINTED WOOD,12.75
21842,PINK HEART CANDY BUTTON CALCULATOR,2.55
22089,PAPER BUNTING VINTAGE PAISLEY,2.95
20734,SILVER MINI TAPE MEASURE ,0.85
35071,ASSORTED SANTA CHRISTMAS DECORATION,0.85
22121,NOEL WOODEN BLOCK LETTERS ,5.95
84836,ZINC METAL HEART DECORATION,1.25
37492A,YELLOW RED FLOWER PIGGY BANK,4.65
10133,COLOURING PENCILS BROWN TUBE,0.85
22113,GREY HEART HOT WATER BOTTLE,3.45
20782,CAMOUFLAGE EAR MUFF HEADPHONES,5.49
22190,LOCAL CAFE MUG,2.1
84029G,KNITTED UNION FLAG HOT WATER BOTTLE,3.75
21489,BLUE WHITE SCARF HOT WATER BOTTLE,3.95
20987,GEISHA GIRL CHOPSTICKS SET/5,1.95
20989,URBAN CHIC CHOPSTICKS SET/5,1.95
21868,POTTING SHED TEA MUG,1.25
21875,KINGS CHOICE MUG,1.25
21826,EIGHT PIECE DINOSAUR SET,1.25
21827,EIGHT PIECE CREEPY CRAWLIE SET,1.25
21828,EIGHT PIECE SNAKE  SET,1.25
16225,RATTLE SNAKE EGGS,1.25
21829,DINOSAUR KEYRINGS ASSORTED,0.21
21638,ASSORTED TUTTI FRUTTI NOTEBOOK,2.1
22218,CAKE STAND LACE WHITE,4.25
22222,CAKE PLATE LOVEBIRD WHITE,4.95
22305,COFFEE MUG PINK PAISLEY DESIGN,2.55
22304,COFFEE MUG BLUE PAISLEY DESIGN,2.55
22302,COFFEE MUG PEARS  DESIGN,2.55
22303,COFFEE MUG APPLES DESIGN,2.55
22127,PARTY CONES CARNIVAL ASSORTED,1.25
21143,ANTIQUE GLASS HEART DECORATION ,1.95
21639,ASSORTED TUTTI FRUTTI KEYRING,0.85
22154,ANGEL DECORATION 3 BUTTONS ,0.42
22155,STAR DECORATION RUSTIC,0.42
21889,WOODEN BOX OF DOMINOES,1.25
85045,GREEN CHRISTMAS TREE STRING 20LIGHT,4.95
85044,RED REINDEER STRING OF 20 LIGHTS,4.95
21587,COSY HOUR GIANT TUBE MATCHES,2.55
21588,RETRO SPOT GIANT  TUBE MATCHES,2.55
21818,GLITTER CHRISTMAS HEART ,0.85
21819,GLITTER CHRISTMAS STAR ,0.85
21817,GLITTER CHRISTMAS TREE,0.85
48111,DOOR MAT 3 SMILEY CATS,6.75
20685,RED SPOTTY COIR DOORMAT,6.75
48194,DOORMAT HEARTS,6.75
21495,SKULLS WRAP,0.42
47505,MINATURE COLOURED GARDENING SET,4.95
10135,COLOURING PENCILS BROWN TUBE,1.25
37492C,GREEN BLUE FLOWER PIGGY BANK,4.65
20677,PINK SPOTTY BOWL,1.25
20676,RED SPOTTY BOWL,1.25
21086,SET/6 RED SPOTTY PAPER CUPS,0.65
21948,SET OF 6 CAKE CHOPSTICKS,1.25
21833,CAMOUFLAGE LED TORCH,1.69
21832,CHOCOLATE CALCULATOR,1.65
22315,200 RED + WHITE BENDY STRAWS,1.25
21870,I CAN ONLY PLEASE ONE PERSON MUG,1.25
22115,METAL SIGN EMPIRE TEA,2.95
21166,COOK WITH WINE METAL SIGN ,1.95
21175,GIN + TONIC DIET METAL SIGN,2.1
21174,POTTERING IN THE SHED METAL SIGN,1.95
22197,"POPCORN HOLDER , SMALL ",0.85
21094,SET/6 RED SPOTTY PAPER PLATES,0.85
72724,SET/6 CHRISTMAS ICICLE T-LIGHTS,1.25
22103,MIRROR MOSAIC T-LIGHT HOLDER ROUND,1.65
37424,WHITE WITH BLACK CATS MUG,0.85
21136,PAINTED METAL PEARS ASSORTED,1.69
21755,LOVE BUILDING BLOCK WORD,5.95
21238,RED SPOTTY CUP,0.85
21240,BLUE  SPOTTY CUP,0.85
21239,PINK  SPOTTY CUP,0.85
84007,MAGIC GARDEN MOUNT FUJI,2.55
84012,MAGIC SHEEP WOOL GROWING FROM PAPER,2.55
22077,6 RIBBONS RUSTIC CHARM,1.65
85049A,TRADITIONAL CHRISTMAS RIBBONS,1.25
85049E,SCANDINAVIAN REDS RIBBONS,1.25
22075,6 RIBBONS ELEGANT CHRISTMAS ,1.65
22076,6 RIBBONS EMPIRE  ,1.65
79323LP,LIGHT PINK CHERRY LIGHTS,6.75
79342B,BROWN FLOWER LIGHTS,6.75
79341,WILLOW BRANCH LIGHTS.,6.75
21258,VICTORIAN SEWING BOX LARGE,12.75
21976,PACK OF 60 MUSHROOM CAKE CASES,0.55
21498,RED SPOTS  WRAP ,0.42
84948,SILVER HANGING T-LIGHT HOLDER DOME,1.65
21537,RETRO SPOTS PUDDING BOWL,4.25
20718,RED SPOTTY SHOPPER BAG,1.25
21173,LOO ROLL  METAL SIGN ,1.65
85124A,PINK JUICY FRUIT PHOTO FRAME,2.55
21539,RETRO SPOTS BUTTER DISH,4.95
16169F,WRAP BLIZZARD,0.42
21527,RETRO SPOT TRADITIONAL TEAPOT ,7.95
21531,RETRO SPOT SUGAR JAM BOWL,2.55
20914,SET/5 RED SPOTTY LID GLASS BOWLS,2.95
21217,RED SPOTTY ROUND CAKE TINS,9.95
21242,RED SPOTTY PLATE ,1.69
22232,JIGSAW TOADSTOOLS 3 PIECE,1.65
21535,RETRO SPOT SMALL MILK JUG,2.55
21844,RETRO SPOT MUG,2.95
22073,RETRO SPOT STORAGE JAR,3.75
22072,TEA CUP AND SAUCER RETRO SPOT,3.75
15056BL,EDWARDIAN PARASOL BLACK,5.95
15056N,EDWARDIAN PARASOL NATURAL,5.95
22254,FELT TOADSTOOL LARGE,1.25
22255,FELT TOADSTOOL  SMALL,0.85
46000S,POLYESTER FILLER PAD 40x40cm,1.45
20964,POLYESTER FILLER PAD 60x40cm,2.55
21788,KIDS RAIN MAC BLUE,0.85
21789,KIDS RAIN MAC PINK,0.85
20682,RED SPOTTY CHILDS UMBRELLA,3.25
84832,ZINC WILLIE WINKIE  CANDLE STICK,0.85
85063,CREAM SWEETHEART MAGAZINE RACK,16.95
48129,DOOR MAT TOPIARY,6.75
22030,SWALLOWS GREETING CARD,0.42
21081,SET/20 POSIES PAPER NAPKINS,0.85
20773,BLUE PAISLEY NOTEBOOK,1.65
20767,BLUE PAISLEY JOURNAL ,2.55
22028,PENNY FARTHING BIRTHDAY CARD,0.42
20622,VIPPASSPORT COVER ,2.1
21122,SET/10 PINK SPOTTY PARTY CANDLES,1.25
21124,SET/10 BLUE SPOTTY PARTY CANDLES,1.25
20657,TROPICAL LUGGAGE TAG,1.25
16156N,"WRAP, FRIENDSHIP ON GREEN",0.42
20673,STRAWBERRIES PRINT BOWL,1.25
84520B,PACK 20 ENGLISH ROSE PAPER NAPKINS,0.85
20619,TROPICAL PASSPORT COVER ,2.1
21866,UNION JACK FLAG LUGGAGE TAG,1.25
20660,VIP LUGGAGE TAG ,1.25
20777,CHRYSANTHEMUM NOTEBOOK,1.65
20774,GREEN FERN NOTEBOOK,1.65
22037,ROBOT BIRTHDAY CARD,0.42
22036,DINOSAUR BIRTHDAY CARD,0.42
21726,MULTI HEARTS  STICKERS,0.85
21544,SKULLS  WATER TRANSFER TATTOOS ,0.85
21004,ROSE DU SUD CHILDS APRON,4.25
84402D,PINK DRESS JEWELLERY STAND ,2.95
84660B,BLACK STITCHED WALL CLOCK,3.75
21429,RED GINGHAM ROSE JEWELLERY BOX,1.65
72754B,F FAIRY POTPOURRI CUSHIONS LAVENDER,1.69
21500,PINK SPOTS  WRAP ,0.42
21431,GREEN GINGHAM FLOWER JEWELLERY BOX,1.65
20748,KENSINGTON COFFEE SET,12.75
72802B,OCEAN SCENT CANDLE IN JEWELLED BOX,4.25
72803A,ROSE SCENT CANDLE JEWELLED DRAWER,4.25
79029,GLASS HONEYPOT WASP CATCHER,1.95
71477,COLOUR GLASS. STAR T-LIGHT HOLDER,3.25
85042,ANTIQUE LILY FAIRY LIGHTS,4.95
21591,COSY HOUR CIGAR BOX MATCHES ,1.25
72801E,S/4 FESTIVE GREEN DINNER CANDLES,1.25
21034,REX CASH+CARRY JUMBO SHOPPER,0.95
85049D,BRIGHT BLUES RIBBONS ,1.25
21985,PACK OF 12 HEARTS DESIGN TISSUES ,0.29
21980,PACK OF 12 RED SPOTTY TISSUES ,0.29
16235,RECYCLED PENCIL WITH RABBIT ERASER,0.21
84347,ROTATING SILVER ANGELS T-LIGHT HLDR,2.55
84990,60 GOLD AND SILVER FAIRY CAKE CASES,0.55
85231E,STRAWBERRY SCENTED SET/9 T-LIGHTS,0.85
85231B,CINAMMON SET OF 9 T-LIGHTS,0.85
72008,FROSTED BOX 9 WHITE T-LIGHT CANDLES,0.42
22071,SMALL RETRO SPOT MUG IN BOX  WHITE,3.75
22070,SMALL RETRO SPOT MUG IN BOX  RED,3.75
84270,ASSTD DESIGN BUBBLE GUM RING,0.21
85049C,ROMANTIC PINKS RIBBONS ,1.25
84352,SILVER CHRISTMAS TREE BAUBLE STAND ,16.95
79067,CORONA MEXICAN TRAY,3.75
22203,MILK PAN RED RETROSPOT,3.75
21353,SILVER SLEIGHBELL  WREATH,7.95
21538,DAIRY MAID  PUDDING BOWL,3.75
21534,DAIRY MAID LARGE MILK JUG,4.95
85053,FRENCH ENAMEL CANDLEHOLDER,2.1
22118,JOY WOODEN BLOCK LETTERS,4.95
35832,WOOLLY HAT SOCK GLOVE ADVENT STRING,5.95
D,Discount,9.0
D,Discount,19.0
21375,LARGE CAMPHOR WOOD FIELD MUSHROOM ,5.45
22109,FULL ENGLISH BREAKFAST PLATE,3.75
22186,RED STAR CARD HOLDER,2.95
47504K,ENGLISH ROSE GARDEN SECATEURS,1.95
47504F,ENGLISH ROSE TORCH,1.65
21809,CHRISTMAS HANGING TREE WITH BELL,1.25
21186,WHITE DOVE HONEYCOMB PAPER GARLAND,1.65
21611,SET OF 12 LILY BOTANICAL T-LIGHTS,2.95
21480,PINK STRIPE HOT WATER BOTTLE,2.95
85170A,SET/6 IVORY BIRD T-LIGHT CANDLES,2.1
85033S,SET/6 SILVER REINDEER T-LIGHTS,1.95
35991,SET/6 BLACK SNOWFLAKE T-LIGHTS ,1.69
22185,SLATE TILE NATURAL HANGING,1.65
21786,RAIN HAT WITH RED SPOTS,0.42
84388,WISE MAN STAR SHAPE EGG PAN,1.65
21918,SET 12 KIDS COLOUR  CHALK STICKS,0.42
51012C,"FEATHER DUSTER, COAL BLACK",1.25
84671B,CROCHET BEAR WITH BLUE STRIPES,2.55
21747,SMALL SKULL WINDMILL,1.25
22330,72 ROUND PINK DOILIES,1.45
84375,SET OF 20 KIDS COOKIE CUTTERS,1.95
84952B,BLACK LOVE BIRD T-LIGHT HOLDER,3.75
20961,STRAWBERRY BATH SPONGE ,1.25
20960,WATERMELON BATH SPONGE,1.25
20966,SANDWICH BATH SPONGE,1.25
17164D,ASS COL SMALL SAND FROG P'WEIGHT,0.42
21890,S/6 WOODEN SKITTLES IN COTTON BAG,2.95
85170D,SET/6 PINK BIRD T-LIGHT CANDLES,2.1
17091J,VANILLA INCENSE IN TIN,1.25
20975,12 PENCILS SMALL TUBE RED SPOTTY,0.65
21440,12 MINI TOADSTOOL PEGS,1.25
22174,PHOTO CUBE,1.65
22150, 3 STRIPEY MICE FELTCRAFT,1.95
22147,FELTCRAFT BUTTERFLY HEARTS,1.45
21356,TOAST ITS - FAIRY FLOWER,1.25
21357,TOAST ITS - DINOSAUR,1.25
21677,HEARTS  STICKERS,0.85
21680,WOODLAND  STICKERS,0.85
21730,GLASS STAR FROSTED T-LIGHT HOLDER,4.95
70007,HI TEC ALPINE HAND WARMER,1.65
70006,LOVE HEART POCKET WARMER,1.65
21650,ASSORTED TUTTI FRUTTI BRACELET,0.65
21892,TRADITIONAL WOODEN CATCH CUP GAME ,1.25
85227,SET/6 3D KIT CARDS FOR KIDS,0.85
20655,QUEEN OF SKIES LUGGAGE TAG,1.25
21990,MODERN FLORAL STATIONERY SET,2.95
21934,SKULL SHOULDER BAG,1.65
21578,WOODLAND DESIGN  COTTON TOTE BAG,2.25
21579,LOLITA  DESIGN  COTTON TOTE BAG,2.25
21577,SAVE THE PLANET COTTON TOTE BAG,2.25
20713,JUMBO BAG OWLS,1.95
20712,JUMBO BAG WOODLAND ANIMALS,1.95
16047,POP ART PEN CASE & PENS,0.85
21561,DINOSAUR LUNCHBOX WITH CUTLERY,2.55
20814,SILVER FINCH DECORATION,1.25
22068, BLACK PIRATE TREASURE CHEST,1.65
21377,SMALL CAMPHOR WOOD FIELD  MUSHROOM,1.65
21379, CAMPHOR WOOD PORTOBELLO MUSHROOM,1.25
20956,PORCELAIN T-LIGHT HOLDERS ASSORTED,1.25
21018,BIRD BOX CHRISTMAS TREE DECORATION,0.85
35995,SET/6 BLACK GLITTER REINDEER CANDLE,2.1
22355,"CHARLOTTE BAG , SUKI DESIGN",0.85
21581,SKULLS  DESIGN  COTTON TOTE BAG,2.25
20727,LUNCH BAG  BLACK SKULL.,1.65
21071,VINTAGE BILLBOARD DRINK ME MUG,1.25
21068,VINTAGE BILLBOARD LOVE/HATE MUG,1.25
22189,CREAM HEART CARD HOLDER,3.95
48179,DOOR MAT SWEET HOME,6.75
48188,DOOR MAT WELCOME PUPPIES,6.75
48184,DOOR MAT ENGLISH ROSE ,6.75
21777,RECIPE BOX WITH METAL HEART,7.95
20969,RED FLORAL FELTCRAFT SHOULDER BAG,3.75
20968,GREEN FLORAL FELTCRAFT SHOULDER BAG,3.75
21737,SET 3 WICKER LOG BASKETS,19.95
84899F,YELLOW PURPLE DAISY FELT PURSE KIT,1.25
84898F,YELLOW FLOWERS FELT HANDBAG KIT,2.1
22207,FRYING PAN UNION FLAG,4.25
21016,LIGHT BIRD HOUSE TREE DECORATION,0.85
20829,GLITTER HANGING BUTTERFLY STRING,2.1
85231G,ORANGE SCENTED SET/9 T-LIGHTS,0.85
21407,BROWN CHECK CAT DOORSTOP ,4.25
21410,COUNTRY COTTAGE  DOORSTOP GREEN,4.25
72800F,4 IVORY DINNER CANDLES GOLD FLOCK,2.55
21411,GINGHAM HEART  DOORSTOP RED,4.25
21993,FLORAL FOLK STATIONERY SET,2.95
21486,PINK HEART DOTS HOT WATER BOTTLE,3.75
21813,GARLAND WITH STARS AND BELLS,4.95
21812,GARLAND WITH HEARTS AND BELLS,4.95
21488,RED WHITE SCARF  HOT WATER BOTTLE,3.95
84029E,RED WOOLLY HOTTIE WHITE HEART.,3.75
75013B,"STRING OF 8 BUTTERFLIES,PINK",1.65
72800E,4 IVORY DINNER CANDLES SILVER FLOCK,2.55
72801G,S/4 BURGUNDY WINE DINNER CANDLES,1.25
72801F,S/4 FESTIVE RED DINNER CANDLES,1.25
22183,CAKE STAND VICTORIAN FILIGREE MED,6.75
POST,POSTAGE,9.58
21732,RED HANGING METAL STAR TLIGHT HLDR,3.39
21754,HOME BUILDING BLOCK WORD,5.45
22083,PAPER CHAIN KIT RETRO SPOT,2.55
22086,PAPER CHAIN KIT 50'S CHRISTMAS ,2.55
21254,SET OF KITCHEN WALL  STICKERS,2.95
85041,SET/4 PINK ORCHID CANDLES IN BOWL,1.45
85040B,SET/4 BLUE FLOWER CANDLES IN BOWL,1.45
79323P,PINK CHERRY LIGHTS,5.45
48184,DOOR MAT ENGLISH ROSE ,5.95
37461,FUNKY MONKEY MUG,0.85
22139,RETRO SPOT TEA SET CERAMIC 11 PC ,4.25
21700,BIG DOUGHNUT FRIDGE MAGNETS,0.85
21673,WHITE SPOT BLUE CERAMIC DRAWER KNOB,1.06
21671,RED SPOT CERAMIC DRAWER KNOB,1.06
21669,BLUE STRIPE CERAMIC DRAWER KNOB,1.06
21500,PINK SPOTS  WRAP ,0.34
20692,FLORAL ELEPHANT SOFT TOY,3.75
20685,RED SPOTTY COIR DOORMAT,5.95
16237,SLEEPING CAT ERASERS,0.21
37410,BLACK AND WHITE PAISLEY FLOWER MUG,0.85
84251F,"GREETING CARD, RITA",0.19
21080,SET/20 RED SPOTTY PAPER NAPKINS ,0.85
21967,PACK OF 12 SKULL TISSUES,0.29
22110,BIRD HOUSE HOT WATER BOTTLE,3.45
84977,WIRE FLOWER T-LIGHT HOLDER,1.25
18010,ASSORTED FRAGRANCE BATH CONFETTI,0.42
22152,PLACE SETTING WHITE STAR,0.42
72267,PREMIUM CHURCH CANDLE,2.1
22081,RIBBON REEL FLORA + FAUNA ,1.65
22079,RIBBON REEL HEARTS DESIGN ,1.65
20758,ABSTRACT CIRCLES POCKET BOOK,0.85
20756,GREEN FERN POCKET BOOK,0.85
21126,SET OF 6 GIRLS CELEBRATION CANDLES,1.25
21125,SET 6 FOOTBALL CELEBRATION CANDLES,1.25
22102,MIRROR MOSAIC T-LIGHT HOLDER ,1.65
35955,SMALL FOLKART CHRISTMAS TREE DEC,0.42
35954,SMALL FOLKART STAR CHRISTMAS DEC,0.42
35957,SMALLFOLKART BAUBLE CHRISTMAS DEC,0.42
84050,PINK HEART SHAPE EGG FRYING PAN,1.65
47568,ENGLISH ROSE DESIGN PEG BAG,2.1
84782A,PINK 3 TIER GLASS PLATE STAND,12.75
84782C,GREEN 3 TIER GLASS PLATE STAND,12.75
22169,FAMILY ALBUM WHITE PICTURE FRAME,8.5
84933A,LARGE GREEN PEONY FOLDING STOOL,2.1
84933B,LARGE PINK PEONY FOLDING STOOL,2.1
