product_id,product_name,price
79163,BLACK CHAMPAGNE GLASS,0.39
21530,DAIRY MAID TOASTRACK,0.79
21096,SET/6 FRUIT SALAD  PAPER PLATES,0.39
21319,GLASS CHALICE GREEN  SMALL ,0.39
21318,GLASS CHALICE BLUE SMALL ,0.39
21654,RIDGED GLASS FINGER BOWL,0.39
79030D,"TUMBLER, BAROQUE",0.39
79030G,"TUMBLER, NEW ENGLAND",0.39
85145,JARDIN ETCHED GLASS LARGE BELL JAR,3.95
15036,ASSORTED COLOURS SILK FAN,0.83
22558,CLOTHES PEGS RETROSPOT PACK 24 ,1.65
21294,ETCHED GLASS COASTER,0.39
22558,CLOTHES PEGS RETROSPOT PACK 24 ,1.0
POST,POSTAGE,350.0
75131,METAL TUBE CHIME ON BAMBOO,1.0
21090,SET/6 COLLAGE PAPER PLATES,0.39
21084,SET/6 COLLAGE PAPER CUPS,0.19
22621,TRADITIONAL KNITTING NANCY,1.65
79051A,SMOKEY GREY COLOUR D.O.F. GLASS,0.29
21891,TRADITIONAL WOODEN SKIPPING ROPE,1.45
84751B,BLACK MEDIUM GLASS CAKE STAND,0.79
47013C,WINE BOTTLE DRESSING DARK BLUE,0.12
47013A,WINE BOTTLE DRESSING LT.BLUE,0.12
22663,JUMBO BAG DOLLY GIRL DESIGN,2.08
21890,S/6 WOODEN SKITTLES IN COTTON BAG,3.25
POST,POSTAGE,134.0
20711,JUMBO BAG TOYS ,2.08
21033,JUMBO BAG CHARLIE AND LOLA TOYS,2.08
21439,BASKET OF TOADSTOOLS,1.06
35809B,ENAMEL BLUE RIM TEA CONTAINER,0.83
79026B,"S/4 ICON COASTER,ELVIS LIVES",0.39
20801,LARGE PINK GLASS SUNDAE DISH,0.79
85146,JARDIN ETCHED GLASS SMALL BELL JAR,1.95
22622,BOX OF VINTAGE ALPHABET BLOCKS,11.95
22623,BOX OF VINTAGE JIGSAW BLOCKS ,5.95
M,Manual,162.6
M,Manual,2382.92
M,Manual,239.3
M,Manual,1252.95
M,Manual,2053.07
21845,DAIRY MAID STRIPE MUG,0.79
21087,SET/6 POSIES PAPER CUPS,0.19
21089,SET/6 GREEN SPRING PAPER CUPS,0.19
84951A,SET OF 4 PISTACHIO LOVEBIRD COASTER,0.79
85099B,JUMBO BAG RED RETROSPOT,1.79
22162,HEART GARLAND RUSTIC PADDED,0.0
84228,HEN HOUSE WITH CHICK STANDING,0.42
16202E,BLACK PHOTO ALBUM ,0.5
79030D,TUMBLER BAROQUE,0.39
20803,SMALL PINK GLASS SUNDAE DISH,0.39
22616,PACK OF 12 LONDON TISSUES ,0.2
M,Manual,1136.3
21320,GLASS CHALICE GREEN  LARGE ,0.79
84843,WHITE SOAP RACK WITH 2 BOTTLES,4.65
47021G,SET/6 BEAD COASTERS GAUZE BAG GOLD,0.39
72801C,4 ROSE PINK DINNER CANDLES,1.06
21316,SMALL CHUNKY GLASS ROMAN  BOWL,0.79
21736,GOLD SCROLL GLASS T-LIGHT HOLDER,0.39
22385,JUMBO BAG SPACEBOY DESIGN,1.79
79331,PINK FLOCK GLASS CANDLEHOLDER,0.38
84877A,PINK ROUND COMPACT MIRROR,1.25
22620,4 TRADITIONAL SPINNING TOPS,1.45
22287,DECORATION WOBBLY CHICKEN,1.65
22927,GREEN GIANT GARDEN THERMOMETER,4.95
22286,DECORATION WOBBLY RABBIT METAL ,1.65
84997C,CHILDRENS CUTLERY POLKADOT BLUE,3.75
23076,ICE CREAM SUNDAE LIP GLOSS,1.04
23254,CHILDRENS CUTLERY DOLLY GIRL ,4.15
23256,CHILDRENS CUTLERY SPACEBOY ,4.15
84750B,BLACK SMALL GLASS CAKE STAND,0.39
84951B,SET OF 4 BLACK LOVEBIRD COASTERS,0.79
84880,WHITE WIRE EGG HOLDER,6.65
D,Discount,1867.86
M,Manual,1867.86
21931,JUMBO STORAGE BAG SUKI,1.79
35965,FOLKART HEART NAPKIN RINGS,0.79
22567,20 DOLLY PEGS RETROSPOT,1.45
85006,SET 4 NURSERY DES ROUND BOXES,0.85
23255,CHILDRENS CUTLERY CIRCUS PARADE,4.15
85008,SET OF 3 CONEY ISLAND OVAL BOXES,1.5
79030G,TUMBLER NEW ENGLAND,0.39
90025A,BAROQUE BUTTERFLY EARRINGS BLACK,3.75
37487B,YELLOW/ORANGE FLOWER DESIGN PLATE,0.29
84575A,PINK DOG CANNISTER,1.95
23205,CHARLOTTE BAG VINTAGE ALPHABET ,0.85
23201,JUMBO BAG ALPHABET,2.08
23207,LUNCH BAG ALPHABET DESIGN,1.65
23199,JUMBO BAG APPLES,2.08
23206,LUNCH BAG APPLE DESIGN,1.65
23204,CHARLOTTE BAG APPLES DESIGN,0.85
23205,CHARLOTTE BAG ALPHABET  DESIGN,0.85
23256,KIDS CUTLERY SPACEBOY ,4.15
23254,KIDS CUTLERY DOLLY GIRL ,4.15
M,Manual,308.82
23208,LUNCH BAG VINTAGE LEAF DESIGN,1.65
23207,LUNCH BAG ALPHABET DESIGN,1.45
23206,LUNCH BAG APPLE DESIGN,1.45
23208,LUNCH BAG VINTAGE LEAF DESIGN,1.45
23201,JUMBO BAG ALPHABET,1.79
37468,HARDMAN MUG 3 ASSORTED,0.39
84388,WISE MAN STAR SHAPE EGG PAN,0.39
23199,JUMBO BAG APPLES,1.79
M,Manual,15.05
47566B,TEA TIME PARTY BUNTING,4.15
37467,PIG MUG IN TWO COLOUR DESIGNS,0.39
POST,POSTAGE,5.95
23201,JUMBO BAG ALPHABET,1.65
23199,JUMBO BAG APPLES,1.65
M,Manual,0.39
23204,CHARLOTTE BAG APPLES DESIGN,0.72
85099C,JUMBO  BAG BAROQUE BLACK WHITE,1.79
23199,JUMBO BAG APPLES,1.95
84997B,CHILDRENS CUTLERY RETROSPOT RED ,3.39
84997A,CHILDRENS CUTLERY POLKADOT GREEN ,3.39
22636,CHILDS BREAKFAST SET CIRCUS PARADE,0.0
21792,CLASSIC FRENCH STYLE BASKET GREEN ,3.95
21793,CLASSIC FRENCH STYLE BASKET BROWN,3.95
84535A,ENGLISH ROSE NOTEBOOK A6 SIZE,0.42
23201,JUMBO BAG ALPHABET,1.95
22785,SQUARECUSHION COVER PINK UNION JACK,6.75
23065,LARGE DECO JEWELLERY STAND,12.5
22846,BREAD BIN DINER STYLE RED ,5.0
16202B,PASTEL BLUE PHOTO ALBUM ,0.5
M,Manual,222.75
23060,HEART BEADED TRELLIS DECORATION,2.08
23057,GEMSTONE CHANDELIER T-LIGHT HOLDER,4.15
POST,POSTAGE,11.0
22825,DECORATIVE PLANT POT WITH FRIEZE,6.75
47566B,TEA TIME PARTY BUNTING,2.55
23057,BEADED CHANDELIER T-LIGHT HOLDER,4.95
85123A,WHITE HANGING HEART T-LIGHT HOLDER,2.4
47556B,TEA TIME TEA TOWELS ,2.1
21175,GIN + TONIC DIET METAL SIGN,1.69
20711,JUMBO BAG TOYS ,1.79
21928,JUMBO BAG SCANDINAVIAN BLUE PAISLEY,1.79
23066,SMALL DECO JEWELLERY STAND,8.25
23068,ALUMINIUM STAMPED HEART,2.49
23075,DOUBLE CERAMIC PARLOUR HOOK,4.15
M,Manual,0.83
23153,ZINC SWEETHEART WIRE LETTER RACK,3.75
71279,PINK GLASS CANDLEHOLDER,2.55
20712,JUMBO BAG WOODLAND ANIMALS,1.79
23075,PARLOUR CERAMIC WALL HOOK,4.15
23073,GEORGIAN TRINKET BOX,12.5
M,Manual,158.21
POST,POSTAGE,3.82
84576,BLUE CAT BISCUIT BARREL PINK HEART,1.95
23146,TRIPLE HOOK ANTIQUE IVORY ROSE,3.29
23061,VINTAGE EMBOSSED HEART,1.25
37489A,YELLOW/PINK FLOWER DESIGN BIG MUG,0.39
37489D,PINK/GREEN FLOWER DESIGN BIG MUG,0.39
37489B,BLUE/YELLOW FLOWER DESIGN BIG MUG,0.39
37489C,GREEN/BLUE FLOWER DESIGN BIG MUG,0.39
85163B,BLACK BAROQUE WALL CLOCK ,3.95
85163A,WHITE BAROQUE WALL CLOCK ,3.95
85183B,CHARLIE & LOLA WASTEPAPER BIN FLORA,0.75
85183A,CHARLIE & LOLA WASTEPAPER BIN BLUE,0.75
22461,SAVOY ART DECO CLOCK,3.95
47563A,RETRO LONGBOARD IRONING BOARD COVER,1.25
20823,GOLD WINE GOBLET,0.79
20827,GOLD APERITIF GLASS,0.39
20826,SILVER APERITIF GLASS,0.39
23055,IVORY CHANDELIER T-LIGHT HOLDER,6.25
23056,FLOWERS CHANDELIER T-LIGHT HOLDER,6.25
21932,SCANDINAVIAN PAISLEY PICNIC BAG,1.65
21933,PINK VINTAGE PAISLEY PICNIC BAG,1.65
23140,TRIPLE WIRE HOOK IVORY HEART,4.15
23141,TRIPLE WIRE HOOK PINK HEART,4.15
23135,SMALL ZINC HEART WALL ORGANISER,5.75
23132,SMALL IVORY HEART WALL ORGANISER,5.75
21896,POTTING SHED TWINE,2.35
23071,MARIE ANTOIENETT TRINKET BOX GOLD,12.5
23152,IVORY SWEETHEART WIRE LETTER RACK ,3.75
23068,ALUMINIUM STAMPED HEART,2.08
23132,SMALL IVORY HEART WALL ORGANISER,4.95
23134,LARGE ZINC HEART WALL ORGANISER,7.05
23133,LARGE IVORY HEART WALL ORGANISER,7.05
23133,LARGE IVORY HEART WALL ORGANISER,8.25
POST,POSTAGE,21.78
POST,POSTAGE,3.96
23147,SINGLE ANTIQUE ROSE HOOK IVORY,1.45
23148,MINIATURE ANTIQUE ROSE HOOK IVORY,0.83
22411,JUMBO SHOPPER VINTAGE RED PAISLEY,1.79
23144,ZINC T-LIGHT HOLDER STARS SMALL,0.72
20846,ZINC HEART LATTICE T-LIGHT HOLDER,1.06
23142,IVORY WIRE KITCHEN ORGANISER,10.4
23136,IVORY WIRE SWEETHEART LETTER TRAY,3.75
23139,SINGLE WIRE HOOK PINK HEART,1.45
23138,SINGLE WIRE HOOK IVORY HEART,1.45
23150,IVORY SWEETHEART SOAP DISH,2.49
23134,LARGE ZINC HEART WALL ORGANISER,8.25
23145,ZINC T-LIGHT HOLDER STAR LARGE,0.95
23253,16 PIECE CUTLERY SET PANTRY DESIGN,15.95
84906,PINK BUTTERFLY CUSHION COVER,1.95
23144,ZINC T-LIGHT HOLDER STARS SMALL,0.83
23137,ZINC WIRE SWEETHEART LETTER TRAY,3.75
21794,CLASSIC FRENCH STYLE BASKET NATURAL,3.95
90135,ORANGE/WHT/FUSCHIA STONES NECKLACE,4.95
35648,VINTAGE BEAD PINK PURSE ,0.83
84859A,SILVER DISCO HANDBAG,1.95
47348A,FUSCHIA VOILE POINTY SHOE DEC,0.39
23069,EDWARDIAN PHOTO FRAME,6.25
16244B,MAXWELL 2 TONE BLUE 60 PAGE PHOTO A,0.5
23131,MISTLETOE HEART WREATH CREAM,4.15
23067,HANGING ENGRAVED METAL HEART,4.15
M,Manual,0.24
22900, SET 2 TEA TOWELS I LOVE LONDON ,2.75
22386,JUMBO BAG PINK POLKADOT,1.74
21928,JUMBO BAG SCANDINAVIAN BLUE PAISLEY,1.74
85099F,JUMBO BAG STRAWBERRY,1.74
85099C,JUMBO  BAG BAROQUE BLACK WHITE,1.74
D,Discount,120.0
21898,POTTING SHED ROSE CANDLE,3.15
D,Discount,11.76
47341B,BLUE TABLE RUN FLOWER,1.25
47341A,FUSCHIA TABLE RUN FLOWER ,1.25
47343A,FUSCHIA FLOWER PURSE WITH BEADS,0.83
47344B,BLUE FLOWER DES PURSE,0.83
62097B,BLUE STRIPES SHOULDER BAG,0.83
62043B,BLUE CHECK BAG W HANDLE 34X20CM,0.83
23163,REGENCY SUGAR TONGS,2.49
23284,DOORMAT KEEP CALM AND COME IN,6.75
23283,DOORMAT VINTAGE LEAVES DESIGN ,7.95
23284,DOORMAT KEEP CALM AND COME IN,7.95
85211,S/4 GROOVY CAT MAGNETS,1.45
21641,ASSORTED TUTTI FRUTTI KEYRING BALL,0.72
16008,SMALL FOLDING SCISSOR(POINTED EDGE),0.08
16216,LETTER SHAPE PENCIL SHARPENER,0.12
16219,HOUSE SHAPE PENCIL SHARPENER,0.16
16218,CARTOON  PENCIL SHARPENERS,0.12
23205,CHARLOTTE BAG ALPHABET  DESIGN,0.72
23078,ICE CREAM PEN LIP GLOSS ,1.04
23077,DOUGHNUT LIP GLOSS ,1.04
23205,CHARLOTTE BAG VINTAGE ALPHABET ,0.72
22994,TRAVEL CARD WALLET RETROSPOT,0.36
22997,TRAVEL CARD WALLET UNION JACK,0.36
23000,TRAVEL CARD WALLET TRANSPORT,0.36
23002,TRAVEL CARD WALLET SKULLS,0.36
23006,TRAVEL CARD WALLET FLOWER MEADOW,0.36
20659,ECONOMY LUGGAGE TAG,1.06
20618,QUEEN OF THE SKIES PASSPORT COVER ,1.69
20619,TROPICAL PASSPORT COVER ,1.69
21865,PINK UNION JACK  PASSPORT COVER ,1.69
23162,REGENCY TEA STRAINER,3.75
22115,METAL SIGN EMPIRE TEA,2.55
85152,HAND OVER THE CHOCOLATE   SIGN ,5.0
82567,"AIRLINE LOUNGE,METAL SIGN",1.69
85231B,CINAMMON SET OF 9 T-LIGHTS,0.72
23137,ZINC WIRE SWEETHEART LETTER TRAY,3.29
23153,ZINC SWEETHEART WIRE LETTER RACK,3.39
23152,IVORY SWEETHEART WIRE LETTER RACK ,3.39
23136,IVORY WIRE SWEETHEART LETTER TRAY,3.29
21441,BLUE BIRDHOUSE DECORATION,0.72
21811,HANGING HEART WITH BELL,1.06
22227,HANGING HEART MIRROR DECORATION ,0.55
22597,MUSICAL ZINC HEART DECORATION ,0.72
22602,RETROSPOT WOODEN HEART DECORATION,0.72
35923,CANDY HEART HANGING DECORATION,1.06
85130B,BEADED CRYSTAL HEART GREEN LARGE,1.45
85131A,BEADED PEARL HEART WHITE ON STICK,1.06
85131C,BEADED CRYSTAL HEART BLUE ON STICK,1.06
20794,BLUE  TILE HOOK,2.1
23140,TRIPLE WIRE HOOK IVORY HEART,3.75
23138,SINGLE WIRE HOOK IVORY HEART,1.25
23139,SINGLE WIRE HOOK PINK HEART,1.25
23146,TRIPLE HOOK ANTIQUE IVORY ROSE,2.89
23147,SINGLE ANTIQUE ROSE HOOK IVORY,1.25
23148,MINIATURE ANTIQUE ROSE HOOK IVORY,0.72
M,Manual,1.01
20816,GOLD FLOWER CUSHION COVER ,1.95
23048,SET OF 10 LANTERNS FAIRY LIGHT STAR,4.15
23042,PAPER LANTERN 7 POINT SNOW STAR,6.65
23041,PAPER LANTERN 9 POINT SNOW STAR,4.15
23040,PAPER LANTERN 9 POINT SNOW STAR ,5.75
23064,CINDERELLA CHANDELIER ,49.95
84687,BEACH HUT SHELF W 3 DRAWERS,4.95
M,Manual,400.0
23130,MISTLETOE HEART WREATH GREEN,4.15
21429,RED GINGHAM ROSE JEWELLERY BOX,1.95
84828,JUNGLE POPSICLES ICE LOLLY MOULDS,1.06
20835,FRENCH LATTICE CUSHION COVER ,0.83
22987,WRAP SUMMER ROSE DESIGN,0.42
46138B,BLUE CHENILLE SHAGGY CUSHION COVER ,0.85
84800S,SMALL WHITE/PINK ROSE ART FLOWER,1.06
20836,FRENCH PAISLEY CUSHION COVER,0.83
20837,FRENCH FLORAL CUSHION COVER ,0.83
23073,GEORGIAN TRINKET BOX,11.15
23160,REGENCY TEA SPOON,1.04
23161,REGENCY CAKE FORK,1.04
23164,REGENCY CAKE SLICE,4.15
23162,REGENCY TEA STRAINER,3.29
23149,ANTIQUE IVORY WIRE BOWL SMALL,2.49
23148,MINITURE ANTIQUE ROSE HOOK IVORY,0.85
21747,SMALL SKULL WINDMILL,1.05
POST,POSTAGE,20.0
23164,REGENCY CAKE SLICE,4.95
POST,POSTAGE,8142.75
M,Manual,6930.0
M,Manual,25.95
79063C,"RETRO PILL BOX KEY CHAIN,THE KING",0.18
84916,HAND TOWEL PALE BLUE W FLOWERS,4.95
35471D,SET OF 3 BIRD LIGHT PINK FEATHER ,0.65
22167, OVAL WALL MIRROR DIAMANTE ,3.95
23135,SMALL ZINC HEART WALL ORGANISER,4.95
23283,DOORMAT VINTAGE LEAVES DESIGN ,6.75
84689,S/2 BEACH HUT TREASURE CHESTS,2.0
23143,ZINC WIRE KITCHEN ORGANISER,10.4
23299,FOOD COVER WITH BEADS SET 2 ,3.75
23298,SPOTTY BUNTING,4.95
23161,REGENCY CAKE FORK,1.25
23160,REGENCY TEA SPOON,1.25
23070,EDWARDIAN HEART PHOTO FRAME,4.15
21621,VINTAGE UNION JACK BUNTING,7.5
23298,SPOTTY BUNTING,4.15
20839,FRENCH PAISLEY CUSHION COVER ,0.85
23151,ZINC SWEETHEART SOAP DISH,2.49
23040,PAPER LANTERN 9 POINT SNOW STAR,5.75
23043,PAPER LANTERN 9 POINT HOLLY STAR 40,6.25
23045,PAPER LANTERN 5 POINT STAR MOON 30,4.15
23041,PAPER LANTERN 6 POINT SNOW STAR,4.15
23298,"BUNTING , SPOTTY ",4.15
84859C,PINK DISCO HANDBAG,1.95
84859B,BLUE DISCO HANDBAG,1.95
23209,LUNCH BAG DOILEY PATTERN ,1.65
23200,JUMBO BAG PEARS,2.08
23203,JUMBO BAG DOILEY PATTERNS,2.08
90076,MONTANA DIAMOND CLUSTER EARRINGS,2.55
23071,MARIE ANTOINETTE TRINKET BOX GOLD,12.5
23072,MARIE ANTOINETTE TRINKET BOX SILVER,12.5
23202,JUMBO BAG VINTAGE LEAF,2.08
23043,PAPER LANTERN 9 POINT HOLLY STAR L,6.25
23046,PAPER LANTERN 9 POINT DELUXE STAR,6.65
23047,PAPER LANTERN 5 POINT SEQUIN STAR,5.75
23044,PAPER LANTERN 9 POINT HOLLY STAR S,4.15
23044,PAPER LANTERN 9 POINT HOLLY STAR 23,4.15
23047,PAPER LANTERN 5 POINT STUDDED STAR,5.75
23299,"FOOD COVER WITH BEADS , SET 2 SIZES",3.75
M,Manual,125.0
35815P,"ACRYLIC JEWEL SNOWFLAKE, PINK",0.38
D,Discount,11.84
23282,FOLDING BUTTERFLY MIRROR IVORY ,0.83
23280,FOLDING BUTTERFLY MIRROR HOT PINK ,0.83
23190,BUNDLE OF 3 SCHOOL EXERCISE BOOKS  ,1.65
23200,JUMBO BAG PEARS,1.65
23191,BUNDLE OF 3 RETRO NOTE BOOKS,1.65
23191,BUNDLE OF 3 RETRO EXERCISE BOOKS,1.65
23175,REGENCY MILK JUG PINK ,3.25
23174,REGENCY SUGAR BOWL GREEN,4.15
23173,REGENCY TEAPOT ROSES ,8.15
23172,REGENCY TEA PLATE PINK,1.65
23171,REGENCY TEA PLATE GREEN ,1.65
23170,REGENCY TEA PLATE ROSES ,1.65
M,Manual,334.71
23175,REGENCY MILK JUG PINK ,2.75
23174,REGENCY SUGAR BOWL GREEN,3.75
23202,JUMBO BAG VINTAGE LEAF,1.95
23200,JUMBO BAG PEARS,1.95
23203,JUMBO BAG DOILEY PATTERNS,1.95
D,Discount,0.03
23209,LUNCH BAG DOILEY PATTERN ,1.45
23173,REGENCY TEAPOT ROSES ,9.95
23081,GREEN METAL BOX ARMY SUPPLIES,8.25
D,Discount,1.45
23084,RABBIT NIGHT LIGHT,2.08
23281,FOLDING BUTTERFLY MIRROR RED  ,0.83
23118,PARISIENNE JEWELLERY DRAWER ,7.5
23096,PETIT TRAY CHIC,1.65
23202,JUMBO BAG VINTAGE LEAF,1.79
23091,ZINC HERB GARDEN CONTAINER,6.25
23094,LE GRAND TRAY CHIC SET,12.5
23108,SET OF 10 LED DOLLY LIGHTS,6.25
23080,RED METAL BOX TOP SECRET,8.25
23108,SET OF 10 LED DOLLY LIGHTS,5.39
23081,GREEN METAL BOX TOP SECRET,8.25
23110,PARISIENNE KEY CABINET ,5.75
23192,BUNDLE OF 3 ALPHABET EXERCISE BOOKS,1.65
23202,JUMBO BAG VINTAGE LEAF,1.65
23203,JUMBO BAG DOILEY PATTERNS,1.65
22663,JUMBO BAG DOLLY GIRL DESIGN,1.79
POST,POSTAGE,3.15
23100,SILVER BELLS TABLE DECORATION,1.25
23102,SILVER HEARTS TABLE DECORATION,0.83
23061,VINTAGE ENGRAVED HEART,1.25
23082,SET 6 PAPER TABLE LANTERN HEARTS ,3.75
16151A,FLOWERS HANDBAG blue and orange,1.25
23093,SMALL PARISIENNE HEART PHOTO FRAME ,2.49
23280,FOLDING MIRROR HOT PINK ,0.83
23084,RABBIT NIGHT LIGHT,1.79
23109,LED TEA LIGHTS,2.49
23103,BELL HEART DECORATION,1.65
23068,ALUMINIUM HEART,2.49
23056,CRYSTAL CHANDELIER T-LIGHT HOLDER,6.25
23057,GEMSTONE CHANDELIER T-LIGHT HOLDER,4.95
23112,PARISIENNE CURIO CABINET,7.5
23109,LED TEA LIGHTS,2.89
23111,PARISIENNE SEWING BOX,12.5
23079,TOADSTOOL BEDSIDE LIGHT ,8.95
21735,TWO DOOR CURIO CABINET,6.0
23167,SMALL CERAMIC TOP STORAGE JAR ,0.69
23104,IVORY PANTRY HANGING LAMP ,12.5
23254,CHILDRENS CUTLERY DOLLY GIRL ,3.75
23170,REGENCY TEA PLATE ROSES ,1.45
23168,CLASSIC SUGAR DISPENSER,1.25
21128,GOLD FISHING GNOME,5.95
M,Manual,929.9
23131,MISELTOE HEART WREATH WHITE,3.75
23130,MISELTOE HEART WREATH ,3.75
23280,FOLDING MIRROR HOT PINK ,0.72
23299,FOOD COVER WITH BEADS SET 2 ,3.39
23169,CLASSIC GLASS SWEET JAR,4.15
23165,LARGE CERAMIC TOP STORAGE JAR,1.45
23071,MARIE ANTOINETTE TRINKET BOX GOLD,11.15
23253,16 PIECE CUTLERY SET PANTRY DESIGN,12.5
23200,JUMBO BAG PEARS,1.79
21033,JUMBO BAG CHARLIE AND LOLA TOYS,1.79
23145,ZINC T-LIGHT HOLDER STAR LARGE,0.79
23163,REGENCY SUGAR TONGS,2.08
23280,FOLDING BUTTERFLY MIRROR HOT PINK ,0.72
23281,FOLDING BUTTERFLY MIRROR RED  ,0.72
21929,JUMBO BAG PINK VINTAGE PAISLEY,1.79
23065,LARGE JEWELLERY STAND,12.5
23066,SMALL JEWELLERY STAND,8.25
23101,SILVER STARS TABLE DECORATION,0.83
23165,LARGE CERAMIC TOP STORAGE JAR,1.65
23166,MEDIUM CERAMIC TOP STORAGE JAR,1.25
23167,SMALL CERAMIC TOP STORAGE JAR ,0.83
15058A,BLUE POLKADOT GARDEN PARASOL,6.75
POST,POSTAGE,523.0
23089,GLASS BON BON JAR,1.65
23107,WHITE WIRE PLANT POT HOLDER,2.89
47566,PARTY BUNTING,0.0
23169,CLASSIC GLASS COOKIE JAR,4.15
23168,CLASSIC CAFE SUGAR DISPENSER,1.25
23103,JINGLE BELL HEART DECORATION,1.65
M,Manual,557.72
23190,BUNDLE OF 3 SCHOOL EXERCISE BOOKS  ,1.45
23191,BUNDLE OF 3 RETRO NOTE BOOKS,1.45
23168,CLASSIC CAFE SUGAR DISPENSER,1.04
23171,REGENCY TEA PLATE GREEN ,1.45
23082,SET 6 PAPER TABLE LANTERN HEARTS ,3.29
23106,ZINC HEARTS PLANT POT HOLDER,2.89
23107,WHITE HEARTS WIRE PLANT POT HOLDER,2.89
23203,JUMBO BAG DOILEY PATTERNS,1.79
23087,ZINC  HEART T-LIGHT HOLDER,1.25
23088,ZINC HEART FLOWER T-LIGHT HOLDER,1.25
23091,METAL HERB GERDEN CONTAINER,6.25
23106,ZINC PLANT POT HOLDER,2.89
23282,FOLDING MIRROR IVORY ,0.83
23281,FOLDING MIRROR RED  ,0.83
23112,PARISIENNE CURIO CABINET,6.65
23172,REGENCY TEA PLATE PINK,1.45
23298,"BUNTING , SPOTTY ",4.95
23111,PARISIENNE SEWING BOX,10.4
23301,GARDENERS KNEELING PAD KEEP CALM ,1.65
23300,GARDENERS KNEELING PAD CUP OF TEA ,1.45
23300,GARDENERS KNEELING PAD CUP OF TEA ,1.65
23091,ZINC HERB GARDEN CONTAINER,5.39
23302,KNEELING MAT HOUSEWORK  DESIGN,1.65
23090,VINTAGE GLASS T-LIGHT HOLDER,0.83
23103,BELL HEART DECORATION,1.45
23083,SET 6 PAPER TABLE LANTERN STARS ,3.75
23092,LARGE ANTIQUE WHITE PHOTO FRAME,7.9
23168,CLASSIC SUGAR DISPENSER,1.04
23118,PARISIENNE JEWELLERY DRAWER ,6.65
23142,IVORY WIRE KITCHEN ORGANISER,9.15
23301,GARDENERS KNEELING PAD KEEP CALM ,1.45
23085,ANTIQUE SILVER BAUBLE LAMP  ,10.4
23283,DOORMAT VINTAGE LEAVES DESIGN ,4.58
21428,SET3 BOOK BOX GREEN GINGHAM FLOWER ,2.66
21430,SET/3 RED GINGHAM ROSE STORAGE BOX,2.33
22501,PICNIC BASKET WICKER LARGE,7.62
23284,DOORMAT KEEP CALM AND COME IN,4.58
20685,DOORMAT RED RETROSPOT,4.58
23099,FRENCH CARRIAGE LANTERN,6.65
23086,ZINC  STAR T-LIGHT HOLDER ,1.25
21929,JUMBO BAG PINK VINTAGE PAISLEY,1.74
85099B,JUMBO BAG RED RETROSPOT,1.74
22913,RED COAT RACK PARIS FASHION,3.37
23134,LARGE ZINC HEART WALL ORGANISER,5.88
82484,WOOD BLACK BOARD ANT WHITE FINISH,4.86
22912,YELLOW COAT RACK PARIS FASHION,3.37
22914,BLUE COAT RACK PARIS FASHION,3.37
23135,SMALL ZINC HEART WALL ORGANISER,3.32
23301,GARDENERS KNEELING PAD KEEP CALM ,1.18
23302,KNEELING MAT HOUSEWORK  DESIGN,1.18
22424,ENAMEL BREAD BIN CREAM,9.42
22061,LARGE CAKE STAND  HANGING STRAWBERY,6.79
37449,CERAMIC CAKE STAND + HANGING CAKES,6.79
22960,JAM MAKING SET WITH JARS,2.96
22666,RECIPE BOX PANTRY YELLOW DESIGN,1.98
22849,BREAD BIN DINER STYLE MINT,11.63
22847,BREAD BIN DINER STYLE IVORY,11.63
22848,BREAD BIN DINER STYLE PINK,11.63
22846,BREAD BIN DINER STYLE RED ,11.63
23300,GARDENERS KNEELING PAD CUP OF TEA ,1.18
82482,WOODEN PICTURE FRAME WHITE FINISH,1.92
22844,VINTAGE CREAM DOG FOOD CONTAINER,6.42
22845,VINTAGE CREAM CAT FOOD CONTAINER,4.27
22349,DOG BOWL CHASING BALL DESIGN,2.46
22700,BLACK AND WHITE DOG BOWL,1.68
22701,PINK DOG BOWL,1.66
D,Discount,9.84
23092,LARGE ANTIQUE WHITE PHOTO FRAME,6.65
22646,CERAMIC STRAWBERRY CAKE MONEY BANK,1.24
23096,PETIT TRAY CHIC,1.45
23192,BUNDLE OF 3 ALPHABET EXERCISE BOOKS,1.45
23282,FOLDING BUTTERFLY MIRROR IVORY ,0.72
23176,ABC TREASURE BOOK BOX ,1.95
23193,BUFFALO BILL TREASURE BOOK BOX,1.95
23177,TREASURE ISLAND BOOK BOX,1.95
23194,GYMKHANA TREASURE BOOK BOX,1.95
22981,PANTRY APPLE CORER,1.25
22918,HERB MARKER PARSLEY,0.55
22919,HERB MARKER MINT,0.55
22920,HERB MARKER BASIL,0.55
22921,HERB MARKER CHIVES ,0.55
22916,HERB MARKER THYME,0.55
22917,HERB MARKER ROSEMARY,0.55
22925,BLUE GIANT GARDEN THERMOMETER,4.95
22928,YELLOW GIANT GARDEN THERMOMETER,4.95
22423,REGENCY CAKESTAND 3 TIER,5.0
M,Manual,293.0
23053,RECYCLED ACAPULCO MAT PINK,7.45
23052,RECYCLED ACAPULCO MAT TURQUOISE,7.45
23049,RECYCLED ACAPULCO MAT RED,7.45
22895,SET OF 2 TEA TOWELS APPLE AND PEARS,2.75
23089,GLASS BON BON JAR,1.45
37471,MULTICOLOUR POLKADOT PLATE,0.85
D,Discount,15.96
POST,POSTAGE,3.71
22179,SET 10 NIGHT OWL LIGHTS,6.75
23130,MISELTOE HEART WREATH ,4.15
23129,HEART SHAPED HOLLY WREATH,4.15
23131,MISELTOE HEART WREATH WHITE,4.15
23090,VINTAGE GLASS T-LIGHT HOLDER,0.72
84806B,WHITE CANDYSTUFT ARTIFICIAL FLOWER,1.25
23104,IVORY CAFE HANGING LAMP ,12.5
D,Discount,0.2
23064,CINDERELLA CHANDELIER ,41.75
POST,POSTAGE,6.5
POST,POSTAGE,75.0
22619,SET OF 6 SOLDIER SKITTLES,0.0
22659,LUNCH BOX I LOVE LONDON,1.9
22625,RED KITCHEN SCALES,6.25
90050,CRACKED GLAZE NECKLACE IVORY,6.95
90141B,IVORY PENDANT TRIPLE SHELL NECKLACE,4.95
M,Manual,1241.98
21930,JUMBO STORAGE BAG SKULLS,1.79
23145,ZINC T-LIGHT HOLDER STARS LARGE,0.95
23169,CLASSIC GLASS SWEET JAR,3.75
23253,16 PC CUTLERY SET PANTRY DESIGN,15.95
22349,DOG BOWL CHASING BALL DESIGN,4.18
M,Manual,60.0
23228,FILIGREE HEART BIRD WHITE ,1.25
23227,FILIGREE HEART BUTTERFLY WHITE ,1.25
84077,WORLD WAR 2 GLIDERS ASSTD DESIGNS,0.11
23086,ZINC STAR T-LIGHT HOLDER ,1.25
23148,MINIATURE ANTIQUE ROSE HOOK IVORY,0.85
C2,CARRIAGE,18.0
23256,CHILDRENS CUTLERY SPACEBOY ,3.75
23255,CHILDRENS CUTLERY CIRCUS PARADE,3.75
23102,SILVER HEARTS TABLE DECORATION,0.72
23101,SILVER STARS TABLE DECORATION,0.72
23110,PARISIENNE KEY CABINET ,4.95
23100,SILVER BELLS TABLE DECORATION,1.04
23083,SET 6 PAPER TABLE LANTERN STARS ,3.29
23080,RED METAL BOX TOP SECRET,7.5
23081,GREEN METAL BOX ARMY SUPPLIES,7.5
23444,Next Day Carriage,15.0
22268,DECORATION SITTING BUNNY,0.85
23226,FILIGREE HEART DAISY WHITE,1.25
23214,JINGLE BELL HEART ANTIQUE GOLD,2.08
23215,JINGLE BELL HEART ANTIQUE SILVER,2.08
90208,PAIR OF PINK FLOWER CLUSTER SLIDE,2.55
23210,WHITE ROCKING HORSE HAND PAINTED,1.25
23213,STAR WREATH DECORATION WITH BELL,1.25
23212,HEART WREATH DECORATION WITH BELL,1.25
23219,LAUREL STAR ANTIQUE SILVER ,1.25
23224,CHERUB HEART DECORATION GOLD,0.83
23221,REINDEER HEART DECORATION SILVER,0.83
23106,ZINC HEARTS PLANT POT HOLDER,2.49
23103,JINGLE BELL HEART DECORATION,1.45
23107,WHITE HEARTS WIRE PLANT POT HOLDER,2.49
23169,CLASSIC GLASS COOKIE JAR,3.75
23211,RED ROCKING HORSE HAND PAINTED,1.04
23214,JINGLE BELL HEART ANTIQUE GOLD,1.79
23212,HEART WREATH DECORATION WITH BELL,1.04
23215,JINGLE BELL HEART ANTIQUE SILVER,1.79
23210,WHITE ROCKING HORSE HAND PAINTED,1.04
23213,STAR WREATH DECORATION WITH BELL,1.04
23216,LAUREL HEART ANTIQUE GOLD,1.04
23217,LAUREL HEART ANTIQUE SILVER,1.04
23225,CHERUB HEART DECORATION SILVER ,0.72
23226,FILIGREE HEART DAISY WHITE,1.04
23227,FILIGREE HEART BUTTERFLY WHITE ,1.04
23302,KNEELING MAT HOUSEWORK  DESIGN,1.45
23228,FILIGREE HEART BIRD WHITE ,1.04
20657,TROPICAL LUGGAGE TAG,1.06
85095,THREE CANVAS LUGGAGE TAGS,1.65
20867,PINK ROSE FABRIC MIRROR,1.06
84050,PINK HEART SHAPE EGG FRYING PAN,1.45
84527,FLAMES SUNGLASSES PINK LENSES,1.65
22439,6 ROCKET BALLOONS ,0.55
21025,SPACE FROG,1.06
21026,SPACE OWL,1.06
84549,CROCHET WHITE RABBIT KEYRING ,1.45
22535,MAGIC DRAWING SLATE BUNNIES ,0.36
M,Manual,11.7
22900,SET 2 TEA TOWELS I LOVE LONDON ,3.25
23275,SET OF 3 HANGING OWLS OLLIE BEAK,1.25
23263,SET OF 3 WOODEN HEART DECORATIONS,1.25
23045,PAPER LANTERN 5 POINT STAR MOON ,4.15
23309,SET OF 60 I LOVE LONDON CAKE CASES ,0.55
15056BL,EDWARDIAN PARASOL BLACK,1.95
15056N,EDWARDIAN PARASOL NATURAL,1.95
22894,TABLECLOTH RED APPLES DESIGN ,8.15
23054,RECYCLED ACAPULCO MAT LAVENDER,7.45
23051,RECYCLED ACAPULCO MAT BLUE,7.45
23050,RECYCLED ACAPULCO MAT GREEN,7.45
23099,FRENCH CARRIAGE LANTERN,5.75
23057,BEADED CHANDELIER T-LIGHT HOLDER,4.15
23270,SET OF 2 CERAMIC PAINTED HEARTS ,1.45
20996,JAZZ HEARTS ADDRESS BOOK,0.19
85213,MINI  ZINC GARDEN DECORATIONS ,0.29
23309,SET OF 60 I LOVE LONDON CAKE CASES ,0.42
23307,SET OF 60 PANTRY DESIGN CAKE CASES ,0.55
22501,PICNIC BASKET WICKER LARGE,3.0
23306,SET OF 36 DOILIES PANTRY DESIGN,1.45
85212,MINI PAINTED GARDEN DECORATION ,0.29
23308,SET OF 60 VINTAGE LEAF CAKE CASES ,0.55
23273,HEART T-LIGHT HOLDER WILLIE WINKIE,1.65
23274,STAR T-LIGHT HOLDER WILLIE WINKIE,1.65
47574A,ENGLISH ROSE SCENTED HANGING FLOWER,0.75
21382,SET/4 SPRING FLOWER DECORATION,0.75
16052,TEATIME PUSH DOWN RUBBER,0.19
22610,PENS ASSORTED FUNNY FACE,0.19
22608,PENS ASSORTED FUNKY JEWELED ,0.19
85184C,SET 4 VALENTINE DECOUPAGE HEART BOX,2.95
20992,JAZZ HEARTS PURSE NOTEBOOK,0.39
D,Discount,42.0
75172,PAINTED SEA SHELL METAL WINDCHIME,0.79
84422,PINK/BLUE DISC/MIRROR STRING,0.39
21371,MIRRORED WALL ART POPPIES,0.75
21365,MIRRORED WALL ART STARS,0.75
20984,12 PENCILS TALL TUBE POSY,0.29
21391,FRENCH LAVENDER SCENT HEART,0.75
22208,WOOD STAMP SET THANK YOU,0.83
22232,JIGSAW TOADSTOOLS 3 PIECE,0.59
22231,JIGSAW TREE WITH BIRDHOUSE,0.59
84944,SET OF 6 KASHMIR FOLKART BAUBLES,1.65
22986,WRAP GINGHAM ROSE ,0.42
22609,PENS ASSORTED SPACEBALL,0.19
21373,MIRRORED WALL ART SNOWFLAKES,0.75
22209,WOOD STAMP SET HAPPY BIRTHDAY,0.83
22161,HEART DECORATION RUSTIC HANGING ,0.19
35471D,SET OF 3 BIRD LIGHT PINK FEATHER ,0.39
16043,POP ART PUSH DOWN RUBBER ,0.12
22269,EGG CUP NATURAL CHICKEN,0.39
16218,CARTOON  PENCIL SHARPENERS,0.06
16216,LETTER SHAPE PENCIL SHARPENER,0.06
21636,MADRAS NOTEBOOK MEDIUM,0.75
23240,SET OF 4 KNICK KNACK TINS DOILEY ,4.15
22230,JIGSAW TREE WITH WATERING CAN,0.29
22342,HOME GARLAND PAINTED ZINC ,0.75
22266,EASTER DECORATION HANGING BUNNY,0.19
21386,IVORY HANGING DECORATION  EGG,0.19
22210,WOOD STAMP SET BEST WISHES,0.83
51014L,"FEATHER PEN,LIGHT PINK",0.39
23238,SET OF 4 KNICK KNACK TINS LONDON ,4.15
22211,WOOD STAMP SET FLOWERS,0.83
16219,HOUSE SHAPE PENCIL SHARPENER,0.06
16259,PIECE OF CAMO STATIONERY SET,0.08
16045,POPART WOODEN PENCILS ASST,0.04
21634,ASSORTED MINI MADRAS NOTEBOOK,0.39
51014A,"FEATHER PEN,HOT PINK",0.39
21658,GLASS  BEURRE DISH,3.75
22783,SET 3 WICKER OVAL BASKETS W LIDS,12.48
23243,SET OF TEA COFFEE SUGAR TINS PANTRY,4.15
84865,NEW BAROQUE BLACK PHOTO ALBUM,2.95
84415B,BLUE FLOCK CUSHION COVER ,1.25
84415A,PINK FLOCK SUEDE CUSHION COVER ,1.25
15058B,PINK POLKADOT GARDEN PARASOL,6.75
85227,SET OF 6 3D KIT CARDS FOR KIDS,0.64
84226,HEN HOUSE W FAMILY IN BARN & NEST,0.64
35912B,WHITE/PINK CHICK DECORATION,1.06
23444,Next Day Carriage,30.0
23245,SET OF 3 REGENCY CAKE TINS,4.95
D,Discount,20.92
23239,SET OF 4 KNICK KNACK TINS POPPIES,4.15
23236,DOILEY STORAGE TIN,2.89
23235,STORAGE TIN VINTAGE LEAF,2.89
23241,TREASURE TIN GYMKHANA DESIGN,2.08
